236,Undergraduate | Cyber Security | IT Audit | Securing Things,https://media-exp1.licdn.com/dms/image/C5103AQH2xB-4Qw9hCw/profile-displayphoto-shrink_200_200/0?e=1589414400&v=beta&t=ghCjT5-NzkrTHMPkt1FYV6L6mXHH4N-XGns8KxqdPZ8,Singapore,"I was hacked several years ago. And it changed how I look at safekeeping my data and protecting my online presence.  I am currently a freshman in the School of Information Systems at the Singapore Management University, majoring in IT Solution Development (Cybersecurity).  I aim to take part in shaping and forming the future of Cyber Security. Developing my knowledge while also interacting with people from different areas to aid them and their industry in protecting their cyber activity.  I am looking for internship opportunities in this area and would love to network with others.",Singapore Management University,Research Assistant,Jan-20,Mar-20,Assisting Assistant Professor Fiona Williamson and others by conducting faculty mapping across the different schools at SMU,,https://www.linkedin.com/company/singapore-management-university,singapore-management-university,Singapore Management University,Teaching Assistant,Jan-20,PRESENT,"Assisting Associate Professor Winston Chow for his SMU-X course on ""Technological Innovations Enhancing Urban Sustainability""",,https://www.linkedin.com/company/singapore-management-university,singapore-management-university,Singapore Management University,Research Assistant,Sep-19,Dec-19,Assisted Associate Professor Winston Chow by doing the following tasks: - Visualized growth of cities population to a bubble map using Python - Compiled literature from a bibliographic search and writing summaries for analysis,,https://www.linkedin.com/company/singapore-management-university,singapore-management-university,,,,,,,,,,,,,,,,,,,,,,,,,,,,,,,,,Singapore Management University,Bachelor of Science,Computer Science,2019,2023,"At the Singapore Management University, I am enlisted in the first cohort of Computer Science students. I will be majoring in IT Solution Development (Cybersecurity).Workshops Attended under SMU Pathfinders Program:* Establishing and Maintaining Authentic Relationships - Dale Carnegie Training* Managing Difficult People - SUTW Impact Consulting",SMAK 1 BPK PENABUR Bandung,High School Diploma,Natural Sciences,2016,2019,"At SMAK 1 BPK PENABUR Bandung, I am enlisted in their Dual Certificate Program which provides both the Cambridge International GCE A Level and the Indonesian Ujian Nasional (UN) Diploma.Activities:* Freshman Orientation Facilitator (AY2018/2019)Subjects taken under the Cambridge International GCE A Level:* Mathematics* Physics* ChemistrySubjects taken under the Indonesian UN:* Mathematics* Physics* English Language* Bahasa Indonesia",,,,,,,"""Cryptography : 0, C (Programming Language) : 0, Python (Programming Language) : 0, Domain Name System (DNS) : 0, Cybersecurity : 0, Information Security : 0, """,,2,Computer & Network Security,1,Cher Boon Sim,Cher Sim,,IEEE Computer Society Members; ISACA; ACM Members; ISACA (Official); IEEE Computer Society; PPI Singapura (Indonesian Students' Association in Singapore),0,0,1,0,0,1,0,0,0,0.03376506
245,"Product Management Office Intern at Bank of Singapore, Asia's Global Private Bank",https://media-exp1.licdn.com/dms/image/C5103AQEtKueNMzShag/profile-displayphoto-shrink_200_200/0?e=1589414400&v=beta&t=rEEoc5x_ad4yIN95DtgAXEq1IiRn8D1uNokYmwSNlMM,Singapore,"I am a driven individual with a passion for solving problems in a creative and efficient manner. I enjoy exploring different ways to tackle a situation and I feel a sense of achievement which cannot be derived elsewhere when I solve problems.  I am intrigued by the concept of investing and making good returns. This interest was further compounded after taking several Finance related modules. As such, I began my investing journey in 2018 and am still learning on how to make better investment decisions.   Some of the things I enjoy are photography, golf and hiking. Photography allows me to express my creative self while hiking gives me a sense of achievement and takes me to unreal places which reminds me that there is so much to be explored in this world.","Bank of Singapore, Asia's Global Private Bank",Product Management Intern,Apr-19,Aug-19,• Coordinated the Product Annual Review by liaising with several functions throughout the Bank and consolidated a central data log for the financials of the Bank’s products • Designed the operational workflow for the BOS International Fund for senior management and the Bank • Constructed Product Approval and Variation papers for new product releases • Supported the PMG (Product Management Group) COO by creating interactive presentations for PMG 4.0 Strategy and other administrative responsibilities,,https://www.linkedin.com/company/bank-of-singapore,bank-of-singapore,Singapore Management University,Teaching Assistant - Economics of Globalisation,Jan-19,May-19,• Mentored a group of 45 students with their problems and challenges with respect to concepts learned in lectures • Assisted the professor with administrative duties such as facilitating group presentations and evaluations,Singapore,https://www.linkedin.com/company/singapore-management-university,singapore-management-university,Singapore Armed Forces (SAF),Security Trooper,Feb-14,Dec-15,• Awarded the Best Soldier of the Month for November 2015 • Designed optimal traffic routes in camp especially during rush hour and events • Ensured overall safety in camp 24/7 by conducting patrols regularly,Singapore,https://www.linkedin.com/company/singapore-armed-forces-saf,singapore-armed-forces-saf,,,,,,,,,,,,,,,,,,,,,,,,,,,,,,,,,Singapore Management University,Bachelor of Business Management,Finance,2016,2020,"Music Director of SMU VOIX•	Led the club to their very first championship award in the “A Cappella Championships” in   July 2017•	Successfully organised the “Do You A Cappella” concert and “VOIX Freshmen Showcase”,         attracting more than 1000 viewers•	Initiated new learning style by teaching members the solfege system •	Communicated with external coaches and overseas arrangers to plan training schedules and procure arrangements for the club",University of St.Gallen,,"Business Administration and Management, General",2018,2018,Exchange Programme,Catholic Junior College,"""A"" Level",,2012,2013,"CJC Choir - Section Leader•	Achieved the championship award for the Antonio Vivaldi Choral Festival, Bulgaria in 2013•	Ensured the music quality of the tenor section was up to par•	Conducted one-to-one practices to monitor individual progress","""Microsoft Excel : 3, Microsoft Word : 2, Microsoft PowerPoint : 2, Digital Photography : 2, Microsoft Outlook : 1, Leadership : 1, """,,2,Financial Services,19,"Jiayi Chia, Nathan Palvannanathan",Jiayi Chia,Nathan Palvannanathan,Credit Suisse; BNP Paribas; J.P. Morgan; Financial Times; HSBC; Bill Gates,0,0,0,0,0.333333333,1,0.214285714,0.1875,0.401785714,0.275607015
257,Performance Executive at PHD | DIGITIZE Alumni at Google,https://media-exp1.licdn.com/dms/image/C5103AQF30dKGA63DQQ/profile-displayphoto-shrink_200_200/0?e=1589414400&v=beta&t=C1DPBVjktpUuofrqr-iIPLS_A1vyx4P6tcyDYcVBtbo,Singapore,"A digital marketing professional with experience across multiple digital platforms, Regine is currently a Performance Executive at PHD, leading programmatic for a key account in the agency.   Supported by the Economic Development Board, Regine is also a graduate of the Google DIGITIZE Program in 2018 which kickstarted her journey in media and programmatic. From a fresh graduate lost in the world of media jargons and technical know-hows, Regine became a champion for digital advertising and enjoys making an impact for brands through the smart use of data, technology and strategy.  With a passion for working with people, she works well in diverse teams, as shown in her current role in PHD where she works with various teams across the agency to connect technical knowledge to education. Regine also strongly believes in the value of culture and drives a team in PHD to create an engaging and supportive environment in the agency.   To exchange ideas and learn more about her adventures, connect with Regine for a chat or at reginehoe@gmail.com",PHD,"Performance Executive, Digital",Oct-18,Mar-20,"• Programmatic & performance lead for key account (HSBC) - consulting for digital media, establishing best practices in areas such as brand safety and verification, ensuring error-free programmatic campaigns • Leading digital projects and solutions such as dynamic creative optimization and cross-channel targeting and attribution - 7 projects across the account within 2019 • Developing the team and client's knowledge in programmatic through Programmatic Education program crafted for advertisers, partners & agency teams • Manage multiple campaigns across multiple digital platforms (Programmatic, Search & Social) • Integrated Media planning, implementation and reporting focused on delivering performance through a full-funnel approach   Clients included HSBC Singapore, HP, Volkswagen Group, Far East Organisation, PropertyGuru, and other smaller accounts. see less",Singapore,https://www.linkedin.com/company/phd-,phd-,PHD,"Performance Executive, Programmatic",Apr-18,Sep-18,"• Drove success in programmatic media through strategic planning, trading excellence, data analysis and report delivery • Executed digital innovations with the team, such as first-in-market Augmented Reality Display Placement in Asia • Managed programmatic campaigns across multiple client portfolios locally and regionally • Key point of contact and developing client knowledge in programmatic - clients include HP, Volkswagen Group, Far East Organisation, PropertyGuru and others see less",Singapore,https://www.linkedin.com/company/phd-,phd-,Google,DIGITIZE Graduate Executive,Feb-18,Sep-18,"Selected as one of 50 trainees to join Google DIGITIZE Program (a collaboration with IMDA) involving 6 weeks of on-site training delivered at Google in marketing foundations, the digital landscape, advertising technology, data analytics, measurement, attribution and programmatic trading.  Assigned to Google Partner Host Company, PHD (under the Omnicom Media Group) from April to September 2018 to work on building the organisation's programmatic capabilities. Day-to-day responsibilities include strategic planning, management and optimisation of a wide spectrum of programmatic campaigns.  Training Focus & Highlights: ● Extensive and in-depth training on Digital Marketing, Programmatic and the role of data ● Use of Google's DoubleClick unified stack solutions (DBM, DCM, DS) ● Familiarisation with other leading players for programmatic solutions (e.g. MediaMath) ● Introduction to host of digital planning and data tools (e.g. Nielsen MediaView) ● Broadening of worldview through networking and interaction with industry experts & professionals   Below is a link to the official description of the DIGITIZE Programme http://www.digitizeacademy.com/#home see less",Singapore,https://www.linkedin.com/company/google,google,Publicis Groupe,Fast Track Intern - Content Specialist & Account Executive,May-17,Aug-17,"Content Specialist • Strategised and executed digital marketing campaigns on various social media platforms for the client – including idea generation, content creation, community management • Planned and implemented Facebook Ad buying – Involved researching the campaign’s target audiences and analysing campaign results to evaluate the effectiveness of the chosen strategy  Account Executive • Assisted the Project Lead on the client’s major global campaign launch - oversaw the planning and implementation of the overall campaign timeline and strategy, from pre-launch to sustenance efforts • Liaised with the client to understand their expectations, thereafter collaborated internally across functions and regionally with agencies in Asia to align the client’s business objectives and strategy see less",Singapore,https://www.linkedin.com/company/publicis-groupe,publicis-groupe,Dell,Marketing Operations Intern (Direct & Channel),May-16,Jul-16,"• Increased product exposure to existing and new customers through setting up newly tailored local and regional marketing collaterals – e.g. eDMs, posters, flyers, catalogues  • Increased customer acquisition and retention through leading and executing events for commercial clients of different sizes and industries, ranging from big customers such as DBS and RWS, to small local IT companies – events such as workshops, customer relations to big exhibitions in expo halls  • Ensured continuous growth in distributors’ margin (B2B marketing) through organising the events of the quarter with the Channels team – to foster better relations with the distributors to incentivize them and initiate new creative ways for them to market to their customers  • Effectively supported the regional marketing team in terms of administration, communication and any other area they required",Singapore,https://www.linkedin.com/company/dell,dell,SMU - Singapore Management University,Teaching Assistant,Jan-16,May-16,"• Served as a teaching assistant alongside Professor Khoo Hock Seng for ""Creative Thinking"", an SMU university core module  • Sent weekly emails to a class of 45 on the professor’s behalf and addressed students queries regarding projects and assignments  • In charge of facilitating weekly class activities and recording class participation  • Effectively used Excel to compile all administrative matters on the professor’s behalf",,https://www.linkedin.com/company/singapore-management-university,singapore-management-university,,,,,,,,,Singapore Management University,Bachelor’s Degree,Marketing,2014,2018,"Human Resource Director of SMU Voix• Talent Management of the club (inclusive of the auditions, members' well-being, club environment) as well as handled the essential administrative mattersProgrammes Deputy Director of Voice Personality Hunt 2015• Planned and executed the different rounds of the annual SMU hosting competition with a team of capable membersProgrammes Committee of SMU VIVACE• Effectively organised and managed the manpower for the performances and programme outline of the annual SMU CCA Fair",Hwa Chong Institution,,,2012,2013,"Activity I/C of the Athena Faculty Committee• Organized and executed cohesion events for the faculty of 400 people under different portfolios (e.g. Faculty Outing, Drama Festival)• Overall in charge for the largest event for 400 people – planned and executed the event with a competent team of 15 people",,,,,,,"""Performance Based Marketing : 1, Reporting & Analysis : 1, Programmatic Media Buying : 1, Multi-channel Marketing : 0, Display Advertising : 0, Digital Marketing : 5, Social Media Marketing : 8, Research : 6, Project Management : 5, Media Planning : 0, Mobile Marketing : 0, Mobile Advertising : 0, Optimization : 0, Search Engine Marketing (SEM) : 0, Integrated Marketing : 0, Marketing Research : 2, Content Marketing : 0, Microsoft Office : 9, SPSS Statistics : 3, PowerPoint : 5, Adobe Photoshop : 4, Microsoft Excel : 5, Microsoft Word : 4, Microsoft PowerPoint : 4, Facebook Ads Manager : 0, Google Ads : 0, Leadership : 6, Management : 5, Public Speaking : 5, Customer Service : 5, Presentation Skills : 0, Problem Solving : 0, WiX : 4, Weebly : 5, DoubleClick : 2, Multi-media Marketing Campaigns : 0, Native Advertising : 0, Online Lead Generation : 0, LinkedIn Advertising : 0, Google Marketing Platform : 0, LinkedIn Campaign Manager : 0, Paid Search Strategy : 0, Audience Segmentation : 0, Digital Transformation : 0, Paid Social Media : 0, """,930,2,Internet,4,"Myron Hoh, KIRPA RAM SHARMA",Myron Hoh,Kirpa Sharma,"Marla Gottschalk, Ph.D.; Unilever; Sallie Krawcheck; Deloitte; Johnson & Johnson; Arianna Huffington",0,0,0,0,0.333333333,1,0.428571429,0.234375,0.662946429,0.305553738
300,Helping others to reach their full potential,https://media-exp1.licdn.com/dms/image/C5103AQHfJcSzKodTUA/profile-displayphoto-shrink_200_200/0?e=1589414400&v=beta&t=44QF9h8jN1kxeukxW_6L_F7u0KUDuadAJOc7J5jNsmY,Singapore,"Having been an introvert since young, I always had the inferiority complex, thinking that I would never be as good as my other peers. But having gone through a rigorous sport like Dragonboat and National Service, I have come to realise that an introvert has a unique strength, which is a listening ear. As an active listener, I am able to understand problems on a deeper level and thereby, formulate optimal solutions.   Having spent at least 4 years in the tertiary Dragonboat team, I have also developed my communication skills and be an effective team player. I live by the following core values: Humility, Empathy, Resilience and Integrity. My time in National Service as a Platoon Commander has given me exposure to many leadership opportunities, such as assuming captaincy in the battalion’s Dragonboat team.   I hope to develop a career as a HR Professional in the future, as I strongly believe in the importance of the 'human' factor in organisations.",Singapore Management University,Sophomore,Aug-17,Mar-20,,Singapore,https://www.linkedin.com/company/singapore-management-university,singapore-management-university,SMU Students'​ Association (SMUSA),Communications Secretary,Jan-19,Dec-19,,,https://www.linkedin.com/company/smu-students-association-smusa,smu-students-association-smusa,Noel Gifts International Ltd,HR Intern,Apr-19,Aug-19,"• Created the Employee Orientation Slides as part of the “Employee Onboarding” process • Created checklists to facilitate both the Employee Onboarding and Employee Offboarding process in the company • Compiled a “Training Directory” for Employee Training & Development • Worked together in a team of 3 to create a seamless course nomination experience as part of Employee Training & Development (Course Nomination Form & Video Tutorial) • Managed the various job search portals for recruitment purposes: JobStreet, Glints, Indeed, FastJobs • Arranged and scheduled interviews for shortlisted applicants • Conducted a first level screening for entry positions see less",,https://www.linkedin.com/company/noel-gifts-international,noel-gifts-international,Singapore Army,Lieutenant,Jul-16,Aug-17,"I was the Platoon Commander in an active battalion, which is heavily involved in urban operations. I was tasked to take charge of a total of 17 men during my time as a Platoon Commander. I was responsible for their performance, overall well-being and more importantly, safety during the course of operations. In addition, I was also appointed the captain of the battalion’s dragonboat team, which clinched victory at the Army Dragonboat Regatta 2017, under the Sharks category. see less",Singapore,https://www.linkedin.com/company/singapore-army,singapore-army,Selffix Pte Ltd,Marketing Assistant,Sep-14,Mar-15,"Did a 6 months internship with Selffix DIY Pte Ltd as a marketing assistant. During my time in the company, I did the following:  1) Managed the social media platforms of the company (eg. Facebook), which includes having to attend to customer queries and feedback  2) Worked in a team of 4 to develop the company’s E-Commerce website, which was launched in 2015  3) Initiated several marketing campaigns, one of which was an integrated social media campaign, which aimed to generate awareness of the new outlets  4) Liaising with external stakeholders of the company, in particular, the suppliers, in lieu of the promotion newsletters for the different festive occasions see less",Singapore,https://www.linkedin.com/company/selffix-pte-ltd,selffix-pte-ltd,,,,,,,,,,,,,,,,,Singapore Management University,Bachelor of Business Management,Business,2017,2021,,Ngee Ann Polytechnic,Diploma in Business Studies (Marketing),Business,2012,2015,"I was appointed the role of Head of Group Leaders in the club, which was an executive committee role. Other than having to train with the team four times a week, with each session lasting 2-3 hours, I am also in charge of the welfare of the team members, as well as managing the team’s morale.",Montfort Secondary School,"Secondary School, ‘O’ Levels",NIL,2008,2011,"I was appointed the role of Head of Administration, who was in charge of the tracking of the unit’s performance and attendance rate in view of the annual Unit Overall Proficiency Award. Achievements include being awarded the Best Unit Cadet in 2011, Unit Overall Proficiency Award (Gold).","""Microsoft Excel : 4, Leadership : 4, Social Media : 4, Microsoft Word : 3, Microsoft PowerPoint : 3, """,,1,Retail,36,"Glenn Lim, Jiayi Chia",Glenn Lim,Jiayi Chia,Early Career Singapore; Keppel Corporation Limited; Health Promotion Board; Piyush Gupta; Unilever; Hays,0,0,0,0,0,1,0.214285714,0.1875,0.401785714,0.298101113
330,Sophomore | Athlete | Tech Enthusiast,https://media-exp1.licdn.com/dms/image/C5603AQEDpqwoGKh4hQ/profile-displayphoto-shrink_200_200/0?e=1589414400&v=beta&t=YNBcBOQ1r9jWRioXYX1emsYeQtTXL1rPwUJBnLlQ11E,Singapore,"Ex- athlete in Singapore National Men's Water Polo team and current goalkeeping coach for Hwa Chong Institution water polo team. Pursuing a Bachelor of Science (Information Systems) degree at Singapore Management University, serving as the captain of the SMU Men's Water Polo team. Concurrently striving to introduce the largest international kids' water polo festival, HaBaWaBa, into Asia.  My passion for sports has made me the person I am today, enabling me by imparting skills, values and perspective. Now, I strive to create equally meaningful and valuable experiences for others the way I have attained mine. Using my increasing know-how in the information systems field, I aim to seize any opportunity in this sector to maximize my drive by impacting larger communities all around.",Singapore Management University,Teaching Assistant (Heuristic Search and Optimization),Jan-20,Mar-20,#NAME?,Singapore,https://www.linkedin.com/company/singapore-management-university,singapore-management-university,Singapore Management University,Teaching Assistant (Database Management),Jan-20,PRESENT,#NAME?,Singapore,https://www.linkedin.com/company/singapore-management-university,singapore-management-university,Singapore Management University,Captain (Aquatic Sharks Water Polo Men's Team),Oct-18,Dec-19,- Captain of the SMU water polo team - Achieved various awards with the team including 1st place at the 2019 NUS Open Water Polo Challenge,Singapore,https://www.linkedin.com/company/singapore-management-university,singapore-management-university,SMU .Hack,Member,Nov-19,PRESENT,,Singapore,https://www.linkedin.com/company/smuhack,smuhack,Habawaba (Asia) Pte Ltd,General Manager,Jan-19,Jan-20,,Singapore,https://www.linkedin.com/search/results/all/?keywords=Habawaba%20(Asia)%20Pte%20Ltd,,KYLT Enterprise,Partner,Nov-17,Jan-20,,Singapore,https://www.linkedin.com/company/kylt-enterprise,kylt-enterprise,Safety@Work Consultancy Pte Ltd.,Web Development Intern,Jun-19,Sep-19,"Created and launched cloud-based web application to automate construction workflow where I handled backend processing, optimisation, and testing of web application using PHP and SQL. Also led a team of 3 interns, managed and trained new interns and reported team progress.",Singapore,https://www.linkedin.com/company/safety-work-consultancy-pte-ltd.,safety-work-consultancy-pte-ltd.,Singapore Management University,Bachelor of Science,Information Systems - Software Development Track,2018,2022,,Hwa Chong Institution,GCE 'A' LEVEL,,2010,2015,,,,,,,,"""Project Management : 2, Object-Oriented Programming (OOP) : 2, Python (Programming Language) : 2, Web Development : 2, Event Management : 0, Social Media Marketing : 0, Event Planning : 1, Sports : 1, Social Media : 0, Java : 2, SQL : 1, PHP : 1, MySQL : 1, Microsoft Office : 1, HTML : 1, Leadership : 2, HTML Scripting : 0, """,248,2,Information Technology & Services,4,"Cher Boon Sim, Randy Lai",Cher Sim,Randy Lai,PSA Singapore; Pacer Water Polo Academy; KYLT Enterprise; PSA International Pte Ltd; FluidLytix (Asia); Bill Gates,0,0,0,1,0,0,0.214285714,0.140625,0.354910714,0.01347263
