459,Leading Organisations Into The New @ Accenture,https://media-exp1.licdn.com/dms/image/C5603AQEMG4aDfHVqWQ/profile-displayphoto-shrink_200_200/0?e=1589414400&v=beta&t=BIo1g-6niQ2mLGsQsRBXtTmXNNSt0mOaI_ym_v2W2cg,Singapore,"Goal-orientated aspiring digital & technology architect, adept at digital business solutions. Close to 10 years experience in the technology industry.   Experienced in managing agile technology projects in a small team. Dedicated leader, equipped with powerful communication, coordination and analysis skills. Able to code in more than five technology languages and learn new languages quickly; also skilled in designing posters, web/mobile user interfaces. Possesses a genuine desire to excel, achieve and improve.  Avid reader into areas of philosophy, behavioural economics and organisational psychology. Biker and marathoner.  MBTI: ISFJ DISC: High Compliance",Accenture,Digital Business Integration Consultant,Dec-18,Mar-20,#NAME?,Singapore,https://www.linkedin.com/company/accenture,accenture,Accenture,Digital Business Integration Analyst,Jun-17,Nov-18,"- Built 7 mobile/web apps and close to 200 production-grade APIs within a span of 1.5 years, catering to various industries ranging from financial services to the products sector - Delivered production-scale cloud infrastructure on Azure handling over 50000 monthly users and digital platform which enabled 2 new monetization models for the client - Designed and built an API developers portal and DevOps asset that enabled an ecosystem and collaboration opportunities to more than 10 industry partners - optimizing team's delivery performance by up to 50% - Delivered a data-driven digital solution that transformed the operations of the client in the beverage industry – enabling 90% of orders to be self-serviced - Managed overall system administration and SOC compliance of 4 projects across various environments on AWS cloud platform see less",Singapore,https://www.linkedin.com/company/accenture,accenture,Accenture,Digital Business Integration Intern,Jan-17,May-17,"- Implemented a digital IoT solution asset involving integration of 3D modelled hardware, mobile/web apps, and cloud technologies - Full stack development work and UX design",Singapore,https://www.linkedin.com/company/accenture,accenture,Singapore Management University,SIS System Administrator,Apr-16,May-17,#NAME?,Singapore,https://www.linkedin.com/company/singapore-management-university,singapore-management-university,Singapore Management University,SIS Laboratory Technical Assistant,Aug-13,May-16,- Managed and maintained more than 10 windows servers and 2 major applications used by 300 students each year - Worked with VMWare vSphere for infrastructure management,Singapore,https://www.linkedin.com/company/singapore-management-university,singapore-management-university,Singapore Management University,SISS Events Director,Jan-15,Jan-16,- In charged of managing a team to plan and execute school event activities for up to 800 students,Singapore,https://www.linkedin.com/company/singapore-management-university,singapore-management-university,Singapore Management University,SISS IT Executive,Jan-14,Jan-15,#NAME?,Singapore,https://www.linkedin.com/company/singapore-management-university,singapore-management-university,Singapore Management University,BSc Information Systems,Information Systems and Services,2013,2017,Graduated with Bachelor of Information Systems with Merit,Republic Polytechnic,Diploma,Business Information Systems,2008,2011,Graduated with Diploma in Business Information Systems with Merit and IDA Singapore Gold Medal,Northbrooks Secondary School,,,2002,2008,,"""HTML : 20, MySQL : 17, Java : 22, Web Applications : 12, Project Management : 7, SEO : 5, Marketing : 5, Copywriting : 4, Digital Media : 3, Search Engine Optimization (SEO) : 3, Business Analysis : 2, Systems Analysis : 2, Shell Scripting : 2, Enterprise Architecture : 0, Cloud Computing : 0, IT Strategy : 0, Digital Strategy : 0, Unix Shell Scripting : 2, PHP : 15, JavaScript : 9, Microsoft Office : 8, WordPress : 7, JSP : 7, Drupal : 4, Photoshop : 4, Adobe Photoshop : 4, Microsoft Excel : 3, JavaServer Pages (JSP) : 2, Microsoft Azure : 0, Spring Boot : 0, Docker : 0, Open API : 0, API Development : 0, Full-Stack Development : 0, Technical Architecture : 0, DevOps : 0, Openshift : 0, Microservices : 0, Kubernetes : 0, IT Business Strategy : 0, IT & Business Strategy Alignment : 0, Enterprise IT Strategy : 0, Technical Project Delivery : 0, Open Banking : 0, """,,2,Information Technology & Services,6,"Victor Wong Jing Ming, Joshua Kajengo",Victor Jing Ming,Joshua Kajengo,Deloitte; Symplicity for JobSeekers; Information Security Community; WordPress; Drupal; Brené Brown,0,0,0,0,0,0,0.214285714,0.1875,0.401785714,0.002945514
460,Tax Associate at KPMG (Tax Planning and Compliance),https://media-exp1.licdn.com/dms/image/C5103AQFeQxu7nN-m0g/profile-displayphoto-shrink_200_200/0?e=1589414400&v=beta&t=owR7KMvPtVd_WDANRsMgCngmdjYeBUihnmlrgCeMCRI,Singapore,,KPMG,Tax Associate,Jul-18,Mar-20,,Singapore,https://www.linkedin.com/company/kpmg,kpmg,Singapore Management University,Teaching Assistant,Aug-15,Dec-17,"Assumed a role of teaching assistant for 7 Modules: MGMT002 - Technology & World Change (3 Semesters) MGMT005 - Managing in a Volatile, Uncertain, Complex and Ambiguous (VUCA) Environment (1 Semester) FNCE102 - Financial Institutions, Instruments and Market (1 Semester) ACCT002 - Accounting for Entrepreneurship (1 Semester) MGMT640 (Masters Module) - HRM for Technology and Operations Manager (1 Semester)  Main job scopes include: - Providing consultation to students who need assistance with the curriculum - Assisted the instructors in managing administrative and project groupings - Facilitated class discussions to stimulate class participation - Organized field trips for students along with the professors see less",,https://www.linkedin.com/company/singapore-management-university,singapore-management-university,Maybank,Investment Analyst Intern,Dec-16,Feb-17,#NAME?,,https://www.linkedin.com/company/maybank,maybank,EDUVALUE,Quality Assurance Intern,May-16,Jul-16,#NAME?,,https://www.linkedin.com/company/eduvalue,eduvalue,RHB Banking Group,Intern,Aug-11,Oct-11,"• Learnt essential skills on interviewing techniques, and being able to ask for more relevant information pertaining to job and organization fit • Assisted senior managers in producing training materials and providing necessary technical support • Attended HR-related talks to understand more about compensation regulations by Ministry of Manpower (MOM) see less",,https://www.linkedin.com/company/rhb-bank,rhb-bank,,,,,,,,,,,,,,,,,Singapore Management University,Double Degree in Business Management and Accounting,Accounting and Finance,2014,2018,,Nanyang Polytechnic,Diploma in Business Management (With Merit),"Human Resources Management/Personnel Administration, General",2009,2012,,,,,,,,"""Microsoft Office : 9, Training : 6, Communication : 5, Finance : 5, Human Resources : 4, Accounting : 4, Recruiting : 2, Programming : 1, Training & Development : 4, Leadership : 4, Customer Service : 3, Management : 2, Performance Appraisal : 2, """,,2,Human Resources,4,"Henry Geraldinio Chong You Fu, Myron Hoh",Henry Chong You Fu,Myron Hoh,SMU Business Society (BONDUE); SMUXtremists AlumniConnect; Nanyang Polytechnic; KPMG; Singapore Management University,0,0,0,0,0,0,0.642857143,0.65625,1.299107143,0.002945514
462,Associate Product Manager at GovTech Government Digital Services,https://media-exp1.licdn.com/dms/image/C5103AQENId-PjDDhGA/profile-displayphoto-shrink_200_200/0?e=1589414400&v=beta&t=IvJqHGnBrkbLDpz3wNvhpyZpWJuu3Sw6dm4QxEF1MGc,Singapore,"Product Manager with a strong interest in Technology and Finance. 3 years of experience in  Product Management for digital platform/software based products in the Banking and Public Service Industry.   Specialties: Release Management, Product Management, Agile Methodologies, Product Strategy and managing a roadmap, across multiple teams.",GovTech Singapore,"Associate Delivery Manager, Government Digital Services",Sep-18,Mar-20,"Product Manager Business Analyst and Scrum Master Agile Project Management Manage Procurement of Agile Team Resources  Projects: Aviation Development Fund (Business Grants Portal, Grant by Civil Aviation Authority of Singapore) Digital Signature Verification (Business Grants Portal, automated verification of digitally signed invoices)  Workshops: Agile Workshops with government agencies to share about Agile Development and SCRUM framework F180 Workshop with new govtechies to share about Agile Quality Management System see less",Singapore,https://www.linkedin.com/company/govtech-singapore,govtech-singapore,DBS Bank,Analyst (Graduate Associate Programme),Jul-16,Aug-18,"Business Analyst and Scrum Master Agile Project Management Oversee end-to-end SDLC cycle for mobile/web development from Requirements Gathering to Production Release Manage project financials within approved budget  Projects: ReferralApp and ScoreApp (iOS, Mobile Solutions for RM Mobility) Implementation Management System (Web-based, Client Implementation Project Management for GTS Products) BusinessClass (iOS, Android, Mobile Solutions for SME Engagement) Mobile Account Opening, Mobile Loans (iOS, Mobile Solutions for Customer Acquisition) ChatBot Project (Web-based, empower customers to do online transactions via a virtual assistant) HK ChatBot Project (Conducted a 2 day requirements gathering workshop with Business Counterparts in Hong Kong Island, Hong Kong) Agile Sprint Planning (Organized a 3-day onsite Agile Introductory session with offshore development team in Hyderabad, India) see less",,https://www.linkedin.com/company/dbs-bank,dbs-bank,PwC Singapore,Technology Consulting Intern,May-15,Jul-15,"• Liaised with stakeholders from OCBC Bank and multiple Open Source Management Software vendors to come up with a 14-Page Comparison Report on which software is most applicable for our client, OCBC Bank. • Was involved in a project to create an Internet of Things (IOT) reference architecture to be used by PWC in Digital Development • Created a 24-page Reference Architecture whitepaper for the Internet of Things Concept with a Director in the Digital Department see less","8 Cross Street, Singapore 048424",https://www.linkedin.com/company/pwc-singapore,pwc-singapore,DFS Group Limited,Business Analyst Intern,May-14,2014,• Helped create KOFAX Optical Character Recognition (OCR) Functional Specification Document • Produced Server Analysis Report for DFS Learning Management System • Initiated procurement process change overhaul with Procurement Solutions Comparison Analysis • Conducted User Experience Testing on DFS regional HR recruitment platform,Singapore,https://www.linkedin.com/company/dfs-group-limited,dfs-group-limited,SMU Peer Helpers,Outreach Event Leader,Aug-13,Dec-13,• Lead a team of SMU students in organising a school-wide event to educate peers on the concept of positive reframing. • Attended to more than 300 students within a budget of $1000. • Attracted Sponsors like P.Osh and Kim San Leng,SMU,https://www.linkedin.com/company/singapore-management-university,singapore-management-university,Singapore Air Force,Administrative Support Assistant,Apr-10,Apr-12,"• Was selected to manage medical database for all NSman of 2 bases, Sembawang Air Base and Chong Pang Air Base. • Attended to more than 1000 NSman cases; responded extraordinary well to emergency situations and conflict management issues, and coped well under intense stress and pressure. • Was trusted heavily by supervisors; and given the role of implementing a new management system of monitoring SAF100s. • Systematic Monitoring of SAF100 caused 60% reduction in late IPPT sign-up confirmations. • Given an opportunity to go overseas training in Brunei",Sembawang Air Base,https://www.linkedin.com/search/results/all/?keywords=Singapore%20Air%20Force,,,,,,,,,,Singapore Management University,Bachelor’s Degree,"Bsc in Information Systems Management, Second Major in Operations Management",2012,2016,SMU Peer Helper | Member/Outreach LeaderSMU Meta Camp 2013 | Facilitator,,,,,,,,,,,,,"""Microsoft Office : 9, PowerPoint : 7, Microsoft Excel : 6, Agile Project Management : 1, Scrum Master : 1, Social Media : 0, Event Planning : 0, Agile Methodologies : 0, Accounting : 0, Business Analysis : 0, Data Analysis : 0, Big Data : 0, Project Management : 0, Operations Management : 0, Business Strategy : 0, Nonprofit Management : 0, Corporate Finance : 0, Product Development : 0, Java : 6, Microsoft Word : 5, HTML : 1, Windows : 0, Outlook : 0, C++ : 0, JIRA : 0, SQL : 0, Teamwork : 2, Time Management : 1, Team Leadership : 1, Customer Service : 0, Public Speaking : 0, Management : 0, Communication : 0, Leadership : 0, Organizational Leadership : 0, Coaching : 0, Mentoring : 0, Talent Management : 0, People Management : 0, English : 1, Personal Finance : 0, Small Business Financial Management : 0, Executive Leadership : 0, Small Business Management : 0, Personal Branding : 0, Pivotal Tracker : 0, Trello : 0, Confluence : 0, Atlassian Suite : 0, Application Programming Interfaces : 0, """,600,2,Information Technology & Services,4,"Riley Ang, Myron Hoh",Riley Ang,Myron Hoh,Financial Times; Singapore Management University; GovTech Singapore; GovTech Solutions; TechCrunch; CNN Business,0,0,0,0,0,0,0.428571429,0.328125,0.756696429,0.002945514
463,"Technology Associate, Software Engineer at Bank of Singapore, Asia's Global Private Bank",https://media-exp1.licdn.com/dms/image/C5103AQGwlwQ5yGQjdQ/profile-displayphoto-shrink_200_200/0?e=1589414400&v=beta&t=4H0ibNrKf-gZx7rD4ss6tRjN99U9CBlAjeaNNyJDG-s,Singapore,"Core experience in Java, C#, RDBMS, Unix shell scripting, multithreading, deployment on various web hosting services and implementing REST-ful web services and microservices.    Hands on experience with Python and R, as well as data visualization tools like Tableau and Qlik.  Day to day hands-on involvement in building new enterprise foundational technologies.   Project experience and day to day involvement in designing system architecture landscapes within Financial Industry under mentorship of Technology Architecture/Digital Enterprise Architecture Team, along with experience in defining solutions architecture with vendor technology teams.   Avid learner to continue growing my passion and interest in solution/enterprise architecture domain, as well as software development (microservices and open API development) space.","Bank of Singapore, Asia's Global Private Bank",Software Engineer (Technology Associate Programme),Jun-19,Mar-20,• Solutions Engineer based in the Innovation Solutions Enginnering Team building new enterprise technologies and scoping solutions architecture with vendor solutions • Software Engineer based in the Technology Architecture (Open API and microservices Development) Team • Software Engineer based in the OCBC Regional Development Centre (Secondment to OCBC Group O&T) building new product launches for OCBC Bank,Singapore,https://www.linkedin.com/company/bank-of-singapore,bank-of-singapore,Freelance Web Developer,Business Analyst and Backend Developer,May-17,PRESENT,• Analyse business processes and provide clients with web development solutions for various business scenarios. • Write reusable code and align system architecture with clients for development and configuration of IT solutions. • Conduct user testing and system training to improve our IT solution and help on-board client to the new workflow. see less,,https://www.linkedin.com/search/results/all/?keywords=Freelance%20Web%20Developer,,Citi,Summer Technology Analyst (Application Developer),May-18,Aug-18,"• Design deployment structure, implement and configure DevOps analysis tool on Unix servers for real-time application performance and trade order process monitoring by global FX development team. • Build and present analytics reporting dashboards and provide high level insights into trade processing flow to FX development and testing teams globally • Build custom shell script services for DevOps Tool to function according to user requirements in global FX Development Team see less",Singapore,https://www.linkedin.com/company/citi,citi,22 Media Pte Ltd,Full Stack Developer Intern,Dec-17,Jan-18,• Aid in design of proprietary Content Management System framework and other web project architecture. • Write reusable code in the backend for proprietry CMS framework and web projects using PHP Laravel framework. • Build front end UI for CMS and web projects using React.js integrated with PHP Laravel framework. see less,Singapore,https://www.linkedin.com/search/results/all/?keywords=22%20Media%20Pte%20Ltd,,Singapore Management University,Final Year Project Full Stack Developer,Apr-17,Dec-17,• Develop E-learning portal for Ang Mo Kio Thye Hwa Kwan hospital by writing reusable code using ASP.NET MVC 4.5 classic framework in C#. • Develop HR-policy enquiry ChatBot using LUIS.AI NLP engine and Microsoft Bot Framework in C#. • Manage database design and handle deployment of applications on hosting servers and on cloud platforms. see less,Singapore,https://www.linkedin.com/company/singapore-management-university,singapore-management-university,,,,,,,,,,,,,,,,,Singapore Management University,Bachelor’s Degree,Information Systems,2015,2019,"• Built and deployed a Geospatial Analytics Web-Application based on data science methods to aid URA's urban planning for the new Jurong Lake Business District.• Built Application using data science analysis techniques like Kernel Density Estimation and Location Quotient.• Presented application and report findings based on custom web application to URA, PSA and other government agencies for planning consideration.",ESCP Europe,Master's degree,"Business, Management, Marketing, and Related Support Services",2018,2018,Fall semester exchange programme with the Master's in Management programme (5th best Executive MBA programme internationally) as a Bachelor's undergraduate,Serangoon Junior College,High School,Humanities/Humanistic Studies,2011,2012,,"""Microsoft Excel : 13, Leadership : 9, PowerPoint : 7, Social Media : 6, Research : 3, Java : 5, MySQL : 4, Ruby : 2, HTML : 2, PHP : 1, ASP.NET MVC : 1, C# : 1, JIRA : 1, Internet Information Services (IIS) : 0, QlikView : 0, JSON : 0, Customer Service : 6, Public Speaking : 5, Devops : 2, Secure Sockets Layer (SSL) : 0, ASP.NET Web API : 0, """,,2,Financial Services,6,"Xavier Lur, Riley Ang",Xavier Lur,Riley Ang,"Jobs in Japan, Career and Job Forum; Michael Dell; Daymond John; Satya Nadella; Justin Trudeau; IBM",0,0,0,0,0,0,0.214285714,0.515625,0.729910714,0.002945514
464,Student - Singapore Management University,https://media-exp1.licdn.com/dms/image/C4E03AQHf_fUS2DyacQ/profile-displayphoto-shrink_200_200/0?e=1589414400&v=beta&t=uE4Q9r2BP8HG_kZjjOcJdNQmus1xtgAOQ7HJHRsi50A,Singapore,"Liang Xin is an enthusiastic and competitive undergraduate student of SMU. She comes from China and has been to Singapore for five years, studying economics (in maritime track) and finance second major and will be graduate soon in 2020.  She has been exposed in many different study and work backgrounds by participates in a lot of CCAs, exchange and study projects. From which she had experience working with Singaporean, Chinese, German, British, Danish, and Japanese. Meanwhile, she got chances to practice leadership skills and team-working in case competitions and trade challenges. Through these experience, she can adapt to new environment quickly, mingle with people well, and manage to get things on track.  She is a team-player who has good skills of networking and communicating, also, in terms of hard skills, she is hardworking, always managed to overcome challenges.",Lianfeng International PTE LTD         Internship,"Researcher, Finance and Admin intern",May-19,Dec-19,"Conduct daily research on stock market, and deep research on specific companies.  Work with finance team, preparing accounts receivable and payable to customers and suppliers, performing monthly-end closing and financial analysis, monthly bank reconciliation, assist in handling invoice, indirect tax, and cash management.",Singapore,https://www.linkedin.com/search/results/all/?keywords=Lianfeng%20International%20PTE%20LTD,,TalentStork         Internship,Research Consultant,May-18,Aug-18,"- Executive Research Daily profile research and interview candidates focus on supply chain, logistics and maritime industry, across the Asian region.  - Marketing strategy Leader of a team of 3, developed and implemented the marketing strategy for the company, maintained the platforms including WeChat, LinkedIn, Company Website, and Facebook, achieved 270% increase of visitorship, and significant increase in customer conversion rate. Analyzed on customer demand and did SEO and SOP of company website to increase the exposure.  - Trainer on maritime desk see less",Singapore,https://www.linkedin.com/company/talentstork,talentstork,,,,,,,,,,,,,,,,,,,,,,,,,,,,,,,,,,,,,,,,,Singapore Management University,Bachelor's degree of Science,Economics (Maritime Track) and Finance,2016,2020,,University of Oxford,International programme - summer school,Economics and Art,2017,2017,A short summer exchange programme,Copenhagen Business School,Bachelor of Business Administration - BBA,Maritime Economics and operations,2018,PRESENT,,"""leadership : 18, Presentation : 20, Communication : 6, Social media : 7, Recruitment : 4, Research : 0, Economics : 0, Microsoft Office : 18, Microsoft Excel : 6, Microsoft Word : 3, Public speaking : 3, Interpersonal Communication : 0, Cultural Awareness : 0, Time Management : 0, Management : 0, Chinese : 6, Mandarin : 3, English : 3, Japanese : 0, 团队合作 : 3, 公开演讲 : 3, Networking : 0, Business Administration : 0, """,,2,Staffing & Recruiting,17,"KELLY DUONG, Sim Willing",Kelly Duong,Sim Willing,The Atlantic; Jeff Weiner; Singapore Management University; Forbes; Copenhagen Business School; Tetra Pak,0,0,0,0,0,0,0.214285714,0.328125,0.542410714,0.002945514
469,LL.B. Undergraduate at Singapore Management University,https://media-exp1.licdn.com/dms/image/C5103AQFWz3g246NY7w/profile-displayphoto-shrink_200_200/0?e=1589414400&v=beta&t=AJmBKeR6Ppxlj_1jKLSM1XNFnAU9GJG5v8QUCAcmWuM,Singapore,"I am a third year undergraduate pursuing an LL.B at Singapore Management University. My interests lie in the fields of criminal and constitutional law.  Outside of school, I have a deep passion for Christian theology, particularly in the branches of systematic theology, apologetics and church history.  Besides being meticulous and responsible, I am a reliable individual who strives to do honest work wherever I am called to be.",Eugene Thuraisingam LLP,Legal Intern,Dec-19,less than a year,#NAME?,,https://www.linkedin.com/company/eugene-thuraisingam-llp,eugene-thuraisingam-llp,"The Bar, SMU Law Society",Finance Associate,Jan-19,Dec-19,#NAME?,Singapore,https://www.linkedin.com/company/the-bar-smu-law-society,the-bar-smu-law-society,Invictus Law Corporation,Legal Intern,Jun-19,Jul-19,#NAME?,,https://www.linkedin.com/search/results/all/?keywords=Invictus%20Law%20Corporation,,Dentons Rodyk,Legal Intern,May-19,less than a year,#NAME?,Singapore,https://www.linkedin.com/company/rodyk-&-davidson,rodyk-&-davidson,Singapore Armed Forces (SAF),Platoon Commander,Apr-16,Mar-17,"Lieutenant (LTA)  [Scope] - Commanded transport resources (vehicles and drivers) - Coordinated transport support and strategic transport plans for 23rd Battalion, Singapore Artillery  [Awards] - Commanding Officer Coin (23rd Battalion, Singapore Artillery) see less",Singapore,https://www.linkedin.com/company/singapore-armed-forces-saf,singapore-armed-forces-saf,FOCUS Education Centre,Teacher,Jan-15,Mar-15,Taught primary and secondary school students a wide range of subjects  [Subjects taught] English Elementary Mathematics Additional Mathematics Chemistry Biology Social Studies see less,Singapore,https://www.linkedin.com/search/results/all/?keywords=FOCUS%20Education%20Centre,,,,,,,,,,Singapore Management University,Bachelor of Laws - LLB,Law,2017,2021,[Academic positions]- Teaching Assistant (Dr. Gilbert Tan)- Research Assistant (Associate Professor Goh Yihan),Victoria Junior College,,"'A' Levels: History, Economics, English Literature, Mathematics",2013,2014,,,,,,,,"""Microsoft Word : 2, Leadership : 0, Legal Writing : 1, Legal Research : 1, Microsoft Excel : 0, Microsoft PowerPoint : 0, Public Speaking : 0, Systematic Theology : 0, Church History : 0, Christian Apologetics : 0, """,,1,Law Practice,12,"Josh Han, Joshua Kajengo",Josh Han,Joshua Kajengo,"Characterist LLC (Incorporating Lie Kee Pong Partnership); Ligonier Ministries; Victoria Junior College; Eugene Thuraisingam LLP; The Bar, SMU Law Society; Dentons Rodyk",0,0,0,0,0,0,0.642857143,0.375,1.017857143,0.002945514
