435,Sophomore at Singapore Management University,https://media-exp1.licdn.com/dms/image/C5103AQHER1Ta9wEh5A/profile-displayphoto-shrink_200_200/0?e=1589414400&v=beta&t=r_BZrfpeUJQMsdo4mkdtCaPbIN-Uzt2gTAa_VmUbNcI,Singapore,"I am a Year 2 Information Systems student majoring in Smart Cities Management & Technology at Singapore Management University.   I have strong interests in cities, and sustainability issues in general. With my programming skills and knowledge of statistics and data analytics, I am keen to take on projects related to different aspects of smart cities to help build a more liveable and sustainable environment for everyone.  Growing up in different cities, I have learnt to adapt to new environments and cultures easily. I believe that learning is a never-ending process, and am willing to expose myself to new challenges, so as to constantly improve myself.",Singapore Management University,Teaching Assistant,Jan-20,Mar-20,Analytics Foundation Module (ANLY104) - Assist professors with in-class facilitation - Assist professors with administrative work related to the module - Provide consultations to students upon requests - Verifying students’ attendance,Singapore,https://www.linkedin.com/company/singapore-management-university,singapore-management-university,Singapore Management University,Teaching Assistant,Aug-19,Dec-19,Introduction to Python Programming Module (IS111) and Sustainable Digital Cities Module (SMT112) - Assist professors with in-class facilitation - Assist professors with administrative work related to the module - Provide first-pass responses to student email queries - Provide consultations to students upon requests - Verifying students’ attendance - Contacting external parties for site visits or for internal lectures see less,Singapore,https://www.linkedin.com/company/singapore-management-university,singapore-management-university,Centre for Liveable Cities         Internship,Data Research & Analytics Intern,May-19,Jul-19,"- Performed research on the complex relationship of population and waste statistics in Singapore using concepts of statistics, analytics and complexity science - Discovered trends and patterns of the dock-less bike sharing system to help improve intra-region mobility using geographic analytics - Compiled examples, sourced for pictures, and proofread Chapter 3 of The UNESCAP Future of Asia-Pacific Cities 2019 Report that has launched during the Asia-Pacific Urban Forum in October 2019 see less",Singapore,https://www.linkedin.com/company/the-centre-of-liveable-cities-ministry-of-national-development,the-centre-of-liveable-cities-ministry-of-national-development,Singapore Management University         Contract,Teaching Assistant,Jan-19,Apr-19,Sustainable Digital Cities Module (SMT112) - Given an exception of being a teaching assistant as a freshman. - Assist professors with administrative work related to the module - Provide first-pass responses to student email queries - Verifying students’ attendance - Contacting external parties for site visits or for internal lectures see less,Singapore,https://www.linkedin.com/company/singapore-management-university,singapore-management-university,Ningbo Cacheng Machinery & Electric Co.,Work Shadowing Programme - Assistant Sales Representative,Dec-16,less than a year,"5 day Overseas Work Shadowing Programme - Roles include organisation and compilation of files, organisation of emails, replying simple emails, simple translation work, and observing company meetings in the sales department - Graded “Excellent” by supervisor for work performance in the programme","Ningbo, Zhejiang, China",https://www.linkedin.com/search/results/all/?keywords=Ningbo%20Cacheng%20Machinery%20%26%20Electric%20Co.,,,,,,,,,,,,,,,,,,Singapore Management University,Bachelor of Science (Information Systems),Smart-Cities Management and Technology,2018,2022,"Some positions held in the societies include:Marketing Director – SMU Truly Malaysia (Sept 2018 – Sept 2019)- Designed and produced marketing collaterals including EDMs and Invitation Cards for all club events. - Organized internal club events and school events together with the Executive Committee and represented Malaysians in Singapore in the Special Tea Session with Dr Mahathir.  Logistics Director – SMU Red Cross Camp 2019 (Mar 2019 – Oct 2019)- Planned programmes along with the programmes division, prepared and directed the logistics flow before, during and after the 3D2N camp.- Coordinated logistics and programme schedule by ensuring effective communication between the organising committee and the incoming 80 freshmen.- First point-of-contact of facilitators and freshmen to answer queries regarding the camp.",Pioneer Junior College,General Certificate of Education - Advanced Level,"H2 Geography, H2 Economics, H2 Chinese Language and Literature, H1 Mathematics",2016,2017,,Kuen Cheng High School,Unified Examination Certificate - Junior Middle Level,"English, Chinese, Malay, Science, Mathematics, History, Geography, Art",2012,2015,,"""Database Design : 0, Public Policy : 0, Python (Programming Language) : 0, Canva : 0, Microsoft Office : 0, Microsoft Excel : 0, SAS : 0, Geographic Information Systems (GIS) : 0, Communication : 0, Teamwork : 0, Leadership : 0, Problem Solving : 0, Database Management System (DBMS) : 0, Data Analytics : 0, """,,2,Information Technology & Services,5,"Giem Teck Khu, Fabian Toh",Giem Khu,Fabian Toh,Ellipsis SMU Information Systems Society; Ministry of National Development Singapore; UCL; Urban Redevelopment Authority of Singapore (URA); Centre for Liveable Cities; Singapore Management University,0,0,0,1,0,0,0.214285714,0.09375,0.308035714,0.015996652
454,Software Engineer at J.P. Morgan Chase & Co.,https://media-exp1.licdn.com/dms/image/C5603AQH7RMoQYHfc3g/profile-displayphoto-shrink_200_200/0?e=1589414400&v=beta&t=innKaHMEyZ93nSLmP_0ugF8pEh5OCMLinSVaP97rDao,Singapore,"A financial technology enthusiast, Eustace has recently started his career at J.P. Morgan Chase & Co., leading global financial institution. He has continued developing his interest in understanding how technology enables the business in the complex landscape of the financial services industry.  Also, being a believer in giving back to the community, Eustace is frequently involved with community-focused projects in the company. For a holistic development & balance, he has also been appointed the location lead for the Software Engineer Program (SEP) Engineer Committee in Singapore.   One of Eustace's guilty pleasures for leisure is to travel. While clearing off the usual 'must-see and must-do' off a bucket list, he enjoys attempting the unusual and travel the path less known to feed his curiosity and desire to know more about the world. The happiest would be when Eustace gets to travel more for less!",JPMorgan Chase & Co.,"Analyst, Software Engineer Program (SEP)",Aug-18,Mar-20,• Global Technology Infrastructure,Singapore,https://www.linkedin.com/company/jpmorganchase,jpmorganchase,JPMorgan Chase & Co.,Student Ambassador,Oct-17,PRESENT,"I am part of the 2017 J.P. Morgan Student Ambassador Program. As a Student Ambassador in Singapore Management University, my role is to increase students’ awareness about the firm and the opportunities that we offer. I work closely with the career services to address the needs of students who express interest in J.P Morgan.",Singapore,https://www.linkedin.com/company/jpmorganchase,jpmorganchase,JPMorgan Chase & Co.,Stretch Role - SEP Engineer Committee 2018 Location Lead (Singapore),Jan-19,Jan-20,,Singapore,https://www.linkedin.com/company/jpmorganchase,jpmorganchase,Singapore Management University,Teaching Assistant,Aug-15,Apr-18,Courses: • Seminar in Information Systems • Management Communication • Process Modelling & Solutions Blueprinting • Interaction Design & Prototyping • Enterprise Web Solutions  Involved with the structuring of the curriculum for the modules and provided constructive feedback in improving the course delivery. Responsible for the tracking and reporting of class performance to the professor.  • Provided 1-to-1 consultations for the courses • Initiated a successful change in the delivery & grading of the course curriculum (Seminar in Information Systems) that impacted a cohort of 277 see less,Singapore,https://www.linkedin.com/company/singapore-management-university,singapore-management-university,Singapore Management University,Research Assistant,Aug-16,Jan-17,"Involved in a research project in the fields of Corporate Communication, blended with the study of Data Analytics. The research project is exploring on the sentiments of the public on the timing in the release of critical news.  • Performed the initial data massaging, and cleaning to ensure relevancy • Performed sentiment and emotion analysis on the data set see less",Singapore,https://www.linkedin.com/company/singapore-management-university,singapore-management-university,JPMorgan Chase & Co.,Summer Technology Analyst,May-17,Jul-17,• Global Technology Infrastructure (GTI),,https://www.linkedin.com/company/jpmorganchase,jpmorganchase,Extentia Information Technology,Development Division Intern,May-16,Aug-16,"Responsible for the development and execution of the prototype on a refurbished Financial Reporting System by liaising closely with the Project Manager and Business Analyst. Involved in the understanding of user requirements, and seeing the project from end-to-end, adopting the Rational Unified Process (RUP) methodology.  • Developed a key prototype, a .NET C# MVC web application using MVC 4 and EF 5 • Integrated SalesForce Database with PostgreSQL and through syncs via Heroku Connect • Explored the technical possibilities on Dependency Injections for newly proposed architecture • Researched and proposed viable solutions for the team to present to the client • Abated client's worry and instill confidence that the proposed architecture is a viable one see less","Pune, Maharashtra, India",https://www.linkedin.com/company/extentia-information-technology,extentia-information-technology,Singapore Management University,Bachelor of Science (B.Sc.),Information Systems,2014,2018,"Activities and Societies:1. Professional Development Director, SMU Information Systems Society 12th Management Committee2. International Services Director, Rotaract Club of Singapore Management University,3. Marketing Director, SMU Information Systems Society 11th Management Committee4. Events Executive, E.Y.E Investment Events Sub-Committee5. Vice President, MetamorphoSIS Camp 2015 Executive Committee6. Member, Rotaract Club of Singapore Management UniversityAwards:1. DBS Bank School Valedictorian Award in Information Systems2. SMU Scholars' Programme3. MIT Club of Singapore Prize 20174. Dean's List for Academic Year 2014-2015, 2015-2016, 2017-20185. Hackathon@SG 2nd Prize6. UBS Group Technology Case Competition, Finalist",KTH Royal Institute of Technology,International Student Exchange Programme,Industrial Engineering,2017,2017,"Embarked on a wonderful semester-long exchange at KTH Royal Institute of Technology, Stockholm, Sweden.Courses Attended:1. Entrepreneurship and Innovation2. Growth - Managing your Firm3. Intercultural Communication4. Programming of Web Services5. Swedish Society, Culture and Industry in Historical Perspective",Nanyang Polytechnic,Diploma,Engineering Informatics,2009,2012,"Activities & Societies:1. Microsoft Student Partner, Microsoft Singapore2. Cadet Inspector, National Police Cadet CorpsAwards:1. Valedictorian2. Nanyang Polytechnic Scholarship3. Cisco Systems (USA) Gold Medal (Top in Cohort)4. Directors' List for All Semesters (2009-2012)","""Java : 30, C# : 25, Software Development : 24, Web Development : 20, Programming : 15, Mobile Applications : 12, Software Engineering : 7, MySQL : 20, SQL : 14, .NET : 12, Microsoft Office : 11, ASP.NET : 10, Objective-C : 8, Visual Studio : 7, CSS : 7, Microsoft SQL Server : 4, Cascading Style Sheets (CSS) : 4, Microsoft Excel : 4, JSP : 3, Visio : 3, .NET Framework : 3, Communication : 4, """,,2,Information Technology & Services,6,"Joshua Kajengo, Henry Geraldinio Chong You Fu",Joshua Kajengo,Henry Chong You Fu,JPMorgan Chase & Co.; Sara Blakely; Jamie Dimon; Singapore Management University; J.P. Morgan,0,0,0,0,0,0,0.214285714,0.140625,0.354910714,0.002945514
456,Real Estate Broker at PropNex Realty Pte Ltd,https://media-exp1.licdn.com/dms/image/C5103AQH98O5z6y_Rgw/profile-displayphoto-shrink_200_200/0?e=1589414400&v=beta&t=KIE96il-p3_7K2gN96LqIpfbRQN76Nl4-1BBFP2sXbQ,Singapore,"Amidst the recent technological advances, Big Data and Data Analytics stand out as the largest buzzwords. With a keen interest to make sense of seemingly mindless data sets, I envision myself as someone who is able to provide value to my customers or organisation through analysis of data and presentation of key findings.  Apart from my academic commitments, I am also passionate about events management. Throughout my brief tenure in SMU, I have held multiple positions in various organising committees, including the Chairperson of SMU's Freshmen Orientation 2018, the largest camp in SMU, that provides to more than 1,800 freshmen. Furthermore, I was also the president of SMU Fencing for the academic year 2018. All these roles have given me enviable skillsets of managing people, work independently and in a team while also juggling academics all within tight deadlines.  Beyond all the nitty gritty details, you can either find me shooting hoops, lifting weights, or at a cafe with friends chatting over really good food and vanilla milkshake.",PropNex Realty Pte Ltd,Real Estate Broker,Aug-19,Mar-20,,,https://www.linkedin.com/company/propnex-realty-pte-ltd,propnex-realty-pte-ltd,Valtech Singapore,Web Development and Analytics Intern,May-19,Jul-19,"- Worked with team of 3 to develop websites for project pitching using NodeJS, Gulp JS, Javascript and CSS - Designed process flow of application and software for UI/UX and Web Development - Researched on chatbot implementation into existing projects and future project pitches to clientele - Content Population using Adobe Experience Manager - Post project analysis using Python to derive insights on signup rates and conversion rates - Collaborated with Sales team directly on slides development to be used for project pitches  Clients worked with: SATS Ltd Pan Pacific Hotel and Resorts Langham Hospitality Group Tokio Marine Holdings Singapore Zoo Nanyang Polytechnic see less",Singapore,https://www.linkedin.com/company/valtech,valtech,Singapore Army,Reconnaissance,Oct-15,Aug-17,"- Infantry Recce Specialist One of the toughest courses available to a National Serviceman, Reconnaissance trains a soldier's fighting spirit, grit, mentality, and ability to adapt to various situations.  - Platoon Sergeant (PS) Assisted in the conduct of training, as well as daily operations within the company Planned monthly duty roster for a company consisting of over 80 people Attended and completed Basic Warfighter Course (BWF) Operational Phase  - Company Sergeant Major (CSM) for NS Reservist  - Represented battalion in overseas training exercises in Taiwan and Malaysia see less",Singapore,https://www.linkedin.com/company/singapore-army,singapore-army,Bosch,Product Marketing Intern,Sep-14,Feb-15,"Organised and planned events for Product Introductions in the Asia Pacific region - Liaised with Business Unit and Sales Teams on large scale projects - Developed Excel Spreadsheet that benchmarks competitors' products against that of Bosch - Liaised with 150 workers and customers to hold 'Product Introduction 2015' for Bosch Video Security at Hilton Arcadia Resort, Phuket see less",Singapore,https://www.linkedin.com/company/bosch,bosch,,,,,,,,,,,,,,,,,,,,,,,,,Singapore Management University,"Bachelor of Science, Information Systems",,2017,2021,"SMU Fencing•	2nd Runner Up of 2019 Asian Varsity Fencing Championships Team Event•	Top 20 Position at NUS Fencing Championships 2019Leadership Roles• 	YEP Leader, Project Pangarap XI 2018• 	President, SMU Fencing (AY17/18)• 	Marketing Director, SMU Yim Siam (AY17/18)• 	Chairperson, SMU Freshmen Orientation 2018•	Chairperson, Asian Varsity Fencing Championships 2018 • 	Clan Head, SMU Information Systems Orientation Camp 2018• 	Marketing Deputy Director, SMU City Games, Sports Camp, Waikiki 2018",Boston University,International Student Exchange Program,,2020,2020,,Ngee Ann Polytechnic,,Business Administration,2012,2015,"Academic Achievements• 	Dean's List, (AY2014/2015) Semester 1, • 	Dean's List, (AY2013/2014) Semester 1, Semester 2• 	Dean's List for Business Communications, Marketing, Finance, Brand Management,         Microeconomics, MacroeconomicsClubs and Societies• 	BA Envoys (Member)• 	NP Fencing (Men's Epee Captain)Achievements• 	2nd Runner Up, Asian Varsity Fencing Championships 2016• 	1st Runner Up Team, Asian Varsity Fencing Championships 2015• 	Champion Team, Novices Fencing Championships 2015• 	1st Runner Up, Novices Fencing Championships 2015• 	2nd Runner Up, Raffles Fencing Invites 2015• 	1st Runner Up, Raffles Fencing Invites 2014","""Adobe Photoshop : 2, iMovie : 2, Keynote : 1, Online Marketing : 1, Digital Marketing : 1, Business Development : 0, Event Management : 0, Microsoft Excel : 1, Microsoft Access : 1, PowerPoint : 1, Microsoft Word : 1, WordPress : 0, Leadership : 0, Guerrilla Marketing : 0, Reconnaissance : 0, Bodybuilding : 0, """,,1,Real Estate,11,"K. J. Shim, Cher Boon Sim",K. Shim,Cher Sim,Valtech; Singapore Management University; PropNex Realty Pte Ltd; Singapore Armed Forces; Singapore Army; Shanghai University,0,0,0,0,0,0,0.428571429,0.421875,0.850446429,0.002945514
457,Cross Border eCommerce | Innovation & Startups | Shopee's Hiring!,https://media-exp1.licdn.com/dms/image/C5103AQHILxaOda0Tkw/profile-displayphoto-shrink_200_200/0?e=1589414400&v=beta&t=TBPdd8LH-fStxsSs_izHNeXoQm055DwgxgIBZuX3YOQ,Singapore,"Experienced professional with a demonstrated history of working in the internet industry. Skilled in Microsoft Word, Public Speaking, Market Research, Adobe Photoshop, and Teamwork. Strong operations professional with a Master’s Degree focused in Innovation and Entrepreneurship from Singapore Management University.",Shopee,Vietnam Cross Border Market,Apr-19,Mar-20,,,https://www.linkedin.com/company/shopee,shopee,Shopee,ID/TH/VN CB Customer Operations/Regional CB Ops,Sep-17,Mar-19,• Brainstormed and executed ID warehouse resale project. Achieved >85% recovery before handover to ID cross border team • Expanded ID CBCS team from 35 to 240 people; THCBCS team from 11 to 31 people; VNCBCS team from 0 to 70+ people. • Proposed and executed IDCBCS structural change and piloted training for IDCBCS leads. • Developed more robust CS performance metrics and CS retention initiatives. see less,,https://www.linkedin.com/company/shopee,shopee,Shopee,Thailand Cross Border eCommerce Operation (Logistics & CS Ops),Dec-16,Aug-17,"• Analyzed and monitored Cross Border logistics performance • Liaised with various departments and regional offices for coordination • Planned and optimized RR, Dispute process, CS escalation process for Cross Border Sellers",,https://www.linkedin.com/company/shopee,shopee,Shopee,Indonesia Cross Border eCommerce (Market & Ops),May-16,Dec-16,"• Analysed Indonesia cross border performance and develop insights on the driving factors • Monitored operational KPIs and identified pain points, providing recommendations for improvement • Worked with internal teams (e.g. BD, Marketing etc) to understand local processes and ensure sufficient exposure for cross border sellers and products • Updated Indonesia Cross Border daily performance and upcoming activities see less",,https://www.linkedin.com/company/shopee,shopee,榴莲出海,Content Contributor,Dec-18,PRESENT,,,https://www.linkedin.com/company/duriantechwatch,duriantechwatch,Singapore University of Technology and Design (SUTD),Research Assistant,Oct-13,Dec-14,"The aim of project, titled Singapore-India Design for Health Project: Health Governance, aims to design a system, product or process which empowers people and health workers to identify, assess and act on individual, family and community health challenges.",,https://www.linkedin.com/company/sutd,sutd,"CapitaMall Labs, CapitaLand Limited",Summer Intern,May-14,Aug-14,• Researched and identified the various emerging or disruptive technologies • Conceptualize potential applications of different technologies in the retail/shopping space,Singapore,https://www.linkedin.com/company/capitaland-limited,capitaland-limited,Singapore Management University,Master’s Degree,Innovation and Entrepreneurship,,PRESENT,• SMU-SUTD Scholarship Holder,Babson College,Babson Entrepreneurship Program,Entrepreneurship/Entrepreneurial Studies,,PRESENT,,Singapore University of Technology and Design (SUTD),Bachelor's Degree,Engineering Systems and Design,,PRESENT,• China Construction Engineering Scholarship Holder,"""Microsoft Office : 32, Research : 26, Photoshop : 23, Social Media : 9, Rapid Prototyping : 8, Statistics : 8, Data Analysis : 8, Market Research : 8, Microsoft Excel : 14, PowerPoint : 13, Microsoft Word : 12, Teamwork : 8, Public Speaking : 8, Leadership : 7, Management : 2, Training : 0, """,9952,2,Internet,5,"Henry Geraldinio Chong You Fu, KIRPA RAM SHARMA",Henry Chong You Fu,Kirpa Sharma,Google; Singapore Careers; Jessica Alba; Fortune Magazine; Singapore Guanxi Network; Richard Branson,0,0,0,0,0,0,0.214285714,0.140625,0.354910714,0.002945514
458,Passion in analyzing data and translating insights to support strategic decision,https://media-exp1.licdn.com/dms/image/C5103AQHLOOTT9kPz6A/profile-displayphoto-shrink_200_200/0?e=1589414400&v=beta&t=RWq5kPAV5K2EE-f4sKNQe73PWhP1rxIjzZVOHoUUQRU,Singapore,I am an Information Systems undergraduate majoring in Smart-city Management and Technology with a keen interest in healthcare-related analytics. I am competent in various data analytics skills from processing of data to visualisation and presentation. I have great interpersonal and negotiation skills. My problem-solving skills complement with my curiosity in search of new insights and pushes analytics to greater heights. I want to discover how the use of data analytics can make strategic management more effective in the healthcare industry.,WaveScan Technologies Pte. Ltd.,Summer Intern,May-19,Sep-19,Application of machine learning algorithm for material classification as well as defect tagging Built a web dashboard that display value generated by the sensors,Singapore,https://www.linkedin.com/company/wavescan-technologies-pte-ltd,wavescan-technologies-pte-ltd,AIA,Claims Administrator,May-15,Oct-15,Processing claims (From Accidental and Hospitalization to Personal Line) Processing of claims' cheques Coordinating of instructions,,https://www.linkedin.com/company/aia,aia,Prudential Assurance Company Singapore,UAT tester,Jan-15,less than a year,Perform various test and make sure there are no technical and mathematical error in the program Troubleshoot technical issues and installing software for financial consultant,,https://www.linkedin.com/company/prudential-assurance-company-singapore,prudential-assurance-company-singapore,,,,,,,,,,,,,,,,,,,,,,,,,,,,,,,,,Singapore Management University,Information Systems,Smart-city Management and Technology,2017,2021,,Ngee Ann Polytechnic,Diploma,Business and Information technology,2012,2015,,,,,,,,"""Microsoft Office : 2, Tableau : 2, Python (Programming Language) : 2, Web Development : 1, Pivot Tables : 1, Basic HTML : 1, CSS : 1, Visual Studio : 1, Microsoft SQL Server : 1, Communication : 1, """,,1,Electrical & Electronic Manufacturing,31,"Jeffrey Lim, Jun Wei Qiu",Jeffrey Lim,Jun Qiu,"Accenture; SAP; Microsoft; GE Healthcare; A*STAR - Agency for Science, Technology and Research; Google",0,0,0,0,0,0,0.214285714,0.1875,0.401785714,0.002945514
