,Title,Avatar,Location,Summary,Organization 1,Organization Title 1,Organization Start 1,Organization End 1,Organization Description 1,Organization Location 1,Organization LI URL 1,Organization LI ID 1,Organization 2,Organization Title 2,Organization Start 2,Organization End 2,Organization Description 2,Organization Location 2,Organization LI URL 2,Organization LI ID 2,Organization 3,Organization Title 3,Organization Start 3,Organization End 3,Organization Description 3,Organization Location 3,Organization LI URL 3,Organization LI ID 3,Organization 4,Organization Title 4,Organization Start 4,Organization End 4,Organization Description 4,Organization Location 4,Organization LI URL 4,Organization LI ID 4,Organization 5,Organization Title 5,Organization Start 5,Organization End 5,Organization Description 5,Organization Location 5,Organization LI URL 5,Organization LI ID 5,Organization 6,Organization Title 6,Organization Start 6,Organization End 6,Organization Description 6,Organization Location 6,Organization LI URL 6,Organization LI ID 6,Organization 7,Organization Title 7,Organization Start 7,Organization End 7,Organization Description 7,Organization Location 7,Organization LI URL 7,Organization LI ID 7,Education 1,Education Degree 1,Education FOS 1,Education Start 1,Education End 1,Education Description 1,Education 2,Education Degree 2,Education FOS 2,Education Start 2,Education End 2,Education Description 2,Education 3,Education Degree 3,Education FOS 3,Education Start 3,Education End 3,Education Description 3,Skills,Followers,Relationship,Industry,Mutual Count,Mutual,Mutual 1,Mutual 2,Interests,School_School of Accountancy,School_School of Economics,Year_Year 1,Year_Year 2,Participation in art activities,Previous Arts CCA_Performance,Number of internships,Length of intern,Career oriented,cosine_distance
14,Incoming Summer Analyst at Bank of America Merrill Lynch,https://media-exp1.licdn.com/dms/image/C5103AQFAo_5MMH_Sag/profile-displayphoto-shrink_200_200/0?e=1589414400&v=beta&t=V7KDqOeJpv6BCPkmLRWy5bBEKxosS5HkT0ZQXGZ2mqM,Singapore,"I am a candidate of Bachelor of Science (Information System) in Singapore Management University. I am interested in software development and data analysis and actively searching for internship opportunities.  I have found out my passion in computing since Junior College. I have chosen H2 computing as one of the course for GCE A level curriculum. I have also participated in various competitions such as EY Next Wave Data Science Challenge and DSTA AI camp. From these competitions, I was able to meet inspiring mentors and broadened my horizon.   I am also interested in the finance industry. As a year 1 student, I am honored to be Quantitative Finance Lab assistant. I have learned how to utilize Bloomberg terminal and basic finance knowledge. I also signed up for the Citi-SMU Portfolio Management elective course. Through this course, we have learnt the basic theory of portfolio management and general investment skills.   As a student who are interested in finance and IT industry. I would like to apply my IT knowledge in finance industry and bring some applicable improvement to the existing platforms.",Bank of America Merrill Lynch,Incoming Summer Analyst (Project Management),Jan-20,Mar-20,,Singapore,https://www.linkedin.com/company/bank-of-america-merrill-lynch,bank-of-america-merrill-lynch,Singapore Management University,Graduate Teaching Assistant (MBA),Jan-20,Feb-20,#NAME?,Singapore,https://www.linkedin.com/company/singapore-management-university,singapore-management-university,Singapore Management University,Teaching Assistant,Aug-19,Dec-19,#NAME?,Singapore,https://www.linkedin.com/company/singapore-management-university,singapore-management-university,J.P. Morgan,Code For Good Hackathon (Singapore Champion),Oct-19,less than a year,"-Together with six great teammates and two helpful mentors, we developed a website for for New Hope Community Service (NHCS), a non-profit organisation who focus on social issues related to rough sleepers in Singapore within 8 hours. -Developed a Telegram Chatbot to facilitate volunteers to report the location and information of rough sleepers. -Integrated blockchain technology into the website to achieve the transparency of donation. see less",Singapore,https://www.linkedin.com/company/jpmorgan,jpmorgan,Lien Centre for Social Innovation,Research Assistant,Jun-19,Sep-19,#NAME?,Singapore,https://www.linkedin.com/company/lien-centre-for-social-innovation-singapore-management-university,lien-centre-for-social-innovation-singapore-management-university,PSA International Pte Ltd,Group Technology (RPA) Intern,May-19,Aug-19,-Automate three manual processes which helps PSA to save over 12000 Singapore dollars and 24 man-days per year. -Interact with process owners and design user acceptance testing cases for the automated process. -Design business process documents for 3 projects in case of system breakdown.,Singapore,https://www.linkedin.com/company/psa,psa,Singapore Management University,Quantitative Finance Trading Lab Assistant,Oct-18,Apr-19,#NAME?,Singapore,https://www.linkedin.com/company/singapore-management-university,singapore-management-university,Singapore Management University,Bachelor's degree,Information Systems,2018,2021,#NAME?,Hwa Chong Institution,A Level,Integrated programme,2013,2017,#NAME?,,,,,,,"""Python (Programming Language) : 3, Microsoft Office : 2, UiPath : 1, Data Analysis : 1, Japanese : 1, """,344,2,Information Technology & Services,13,"Zefang Tang, Cher Boon Sim",Zefang Tang,Cher Sim,Tableau User Group Singapore; Hwa Chong Alumni; Goldman Sachs; Hwa Chong Scholars; Richard Branson; EY,0,0,0,1,0,0,0.214285714,0.140625,0.354910714,0.01347263
74,Penultimate Year Student at Singapore Management University,https://media-exp1.licdn.com/dms/image/C5103AQHF8AUxDmCnNQ/profile-displayphoto-shrink_200_200/0?e=1589414400&v=beta&t=JHzKonkOuYaUW1tXfgTbXypTmJBvpnCifIDWO_-3gv4,Singapore,"Daniel is a penultimate year student pursuing double degrees in Business Management (major in Operations Management) and Information Systems (major in Business Analytics). He is passionate about FinTech industries, especially in the digital payments space. He thrives in startup-like environments where he can contribute and work on his initiatives, while being constantly challenged in a face-paced environment.",99.co,Data Operations Intern,May-19,Aug-19,"Key Areas of Work: • Automation for process improvement • Search Engine Optimization • Data Querying and Report Generation • Website building and design, with use of Google Analytics and Tag Manager",Singapore,https://www.linkedin.com/company/99-co,99-co,Singapore Management University,Undergraduate Teaching Assistant,Jan-19,Apr-19,Teaching Assistant for the Web Application Development undergraduate course at the School of Information Systems,Singapore,https://www.linkedin.com/company/singapore-management-university,singapore-management-university,,,,,,,,,,,,,,,,,,,,,,,,,,,,,,,,,,,,,,,,,Singapore Management University,Double Degree in Business Management and Information Systems,Operations Management and Business Analytics,2017,2021,"Awards and Achievements:• ASEAN Undergraduate Scholarship• Dean's List in AY 2017/18, AY 2018/19Co-Curricular Involvement:• Events Executive of SMU SoundFoundry• Human Resource Director of Metamorphosis Orientation Camp 2018",Copenhagen Business School,International Student Exchange Programme,,2019,2019,"Key Learning Areas:• Machine Learning techniques for Big Data Analytics (e.g. Classification, Regression, Clustering)• Time Series Forecasting methods (e.g. ARIMA, Exponential Smoothing)• Managing Platform Businesses• In-depth look into the FinTech Industry",Raffles Institution,GCE 'A' Levels,Science,2009,2014,"Awards and Achievements:• Dean's List for Biology, Chemistry and Mathematics• 7 Distinctions in GCE 'A' Levels","""Python : 6, Machine Learning : 0, Time Series Analysis : 0, Business Analytics : 2, Operations Management : 0, R : 1, Microsoft Office : 4, MySQL : 6, HTML : 5, Cascading Style Sheets (CSS) : 3, PHP : 4, Microsoft Excel : 1, Visio : 0, Tableau : 2, R Shiny : 0, Microsoft PowerPoint : 1, Flask : 1, SQL : 0, Amazon Lex : 1, Big Data Analytics : 1, Database Modeling : 6, Web Application Development : 7, Microservices : 0, Geospatial Data Analysis : 1, TIBCO BusinessWorks : 2, PHP Applications : 2, Keyword Research : 0, On-Page Optimization : 0, """,,2,Information Technology & Services,16,"Zefang Tang, Benedict Then",Zefang Tang,Benedict Then,Copenhagen Business School; J.P. Morgan; Medtronic; Microsoft; Amazon; Google,0,0,0,0,0.333333333,0,0.214285714,0.140625,0.354910714,0.019242085
105,Sophomore,https://media-exp1.licdn.com/dms/image/C5103AQE5-hWWbhiVmQ/profile-displayphoto-shrink_200_200/0?e=1589414400&v=beta&t=2A7Dyw3VCcRigOZIefCJ0LfO2z90zQ_fkpcn90JxI6Y,Singapore,"I am a sophomore in Singapore Management University with a fascination for the headstrong establishment of a Smart-City environment in Singapore. I absolutely enjoy programming and writing creatively. Do feel free to reach out, I'm always up for a good conversation over tea :)  Data analytics in urban planning & management is an area that excites me. I hope to work alongside inter-disciplinary experts in achieving essential blueprints with a social cause.  Expected year of graduation: 2022",Singapore Management University,Student,Aug-18,Mar-20,,Singapore,https://www.linkedin.com/company/singapore-management-university,singapore-management-university,Singapore Management University,Teaching Assistant,Jan-20,PRESENT,,Singapore,https://www.linkedin.com/company/singapore-management-university,singapore-management-university,Singapore Management University,Teaching Assistant,Aug-19,Nov-19,Mentoring and supporting a class of over 40 candidates in programming (Python),Singapore,https://www.linkedin.com/company/singapore-management-university,singapore-management-university,SMU Institute of Innovation & Entrepreneurship,Freelance Writer,Jan-20,PRESENT,,Singapore,https://www.linkedin.com/company/smuiie,smuiie,Kodecoon Academy,Intern,May-19,Aug-19,"- Engaged and catalysed the origin of Kodecoon’s Social Enterprise, which aims to serve over 3000 children from multiple beneficiaries and equip them with relevant digital literacy - Managed relations and connections with multiple beneficiaries and University clubs - Restructuring student curriculum for Social Enterprise and CodeXtreme 2019 - Teaching and designing 1. Games with Roblox using Lua Scripting 2. Virtual Realities with CoSpaces for over twenty children aged 9-14 see less",Singapore,https://www.linkedin.com/company/kodecoon-academy,kodecoon-academy,Kodecoon Academy,Course Instructor,May-19,less than a year,"- Engaged children in prototype-making activities & supported children's learning progress in programming simple websites using HTML & CSS - Supervised groups of primary school students in Kode-it-Sparkies Hackathon 2019, one of which bagged the Most Innovative Project award",Singapore,https://www.linkedin.com/company/kodecoon-academy,kodecoon-academy,Grab,Leads,Apr-18,Jul-18,"- Responsible for contacting, acquiring and converting interested drivers for GrabHitch through post-marketing strategies i.e. referral campaigns, social media advertisements - Maintained a high conversion rate of 25 drivers per day",Singapore,https://www.linkedin.com/company/grabapp,grabapp,Singapore Management University,Information Systems,Smart-City Management & Technology,2018,2022,"- SMU Business Intelligence & Analytics: Ongoing Marketing Director for AY2019/2020, Teaching Assistant for Tableau Workshop, Python Workshop, SQL Workshop- International Connections Camp 2019: Facilitator- Arts & Cultural Fraternity: Operations Director for Arts Camp 2019- Ellipsis Freshmen Coding Workshop 2019: Teaching AssistantParticipated in the following Hackathons/ Challenges:- SMU LIT Hackathon 2019- Cyber Defenders Discovery Camp 2019 (semi-finalist)- URA Sparks Challenge 2019- FutureX Case Competition 2019- Shopee Challenge 2019- PicoCTF 2019",,,,,,,,,,,,,"""Python (Programming Language) : 0, SAS Enterprise Guide : 0, Tableau : 0, Writing : 0, Data Management : 0, Game Design : 0, Adobe Photoshop : 0, SQL : 0, Adobe Premiere Pro : 0, Adobe Indesign CC : 0, Microsoft Office : 0, Content Management Systems (CMS) : 0, Adobe Lightroom : 0, Microsoft PowerPoint : 0, Adobe Illustrator : 0, Google Analytics : 0, Google Data Studio : 0, Google BigQuery : 0, NoSQL : 0, Adobe XD : 0, HTML : 0, Cascading Style Sheets (CSS) : 0, Lua Scripting : 0, Web Scraping : 0, API Development : 0, """,,2,Information Technology & Services,16,"Philip Tan, Ming Shan Hee",Philip Tan,Ming Hee,SAP; Google; DHL; The Walt Disney Company; PayPal; Microsoft,0,0,0,1,0.333333333,0,0.214285714,0.140625,0.354910714,0.011199496
127,Penultimate Information Systems Student at Singapore Management University,https://media-exp1.licdn.com/dms/image/C5103AQH5gV4QVLD3Qg/profile-displayphoto-shrink_200_200/0?e=1589414400&v=beta&t=o2E7Q0prVbV-ZxTVyFllviJN0GRyuYlZynQHgTS2icw,Singapore,"I am a Y3 Information Systems undergraduate student at Singapore Management University, majoring in data analytics and artificial intelligence.   I love problem-solving and bringing user-centric products to life. I'm passionate about digital innovation and technologies being used to transform industries, businesses and lives.",Linde,"Software Engineering Intern, Linde.Digital",May-19,Aug-19,"• Worked with Business Units to gather business requirements and translate them into technical requirements and prototypes. • Developed scripts for data cleaning, parsing and validation. • Recommended and applied machine learning algorithms for Natural Language Processing. • Piloted and developed a proof-of-concept Travel Safety Platform for Safety, Health, Environment and Quality and Human Resources in ReactJS that would help to improve employee safety and reduce work-related safety travel incidents.",,https://www.linkedin.com/company/linde,linde,Newstead Technologies Pte. Ltd.,Event Salesperson,Feb-17,Mar-17,• Established good rapport with customers to drive sales and managed to exceed sales target by 10%.,Singapore,https://www.linkedin.com/company/newstead-technologies-pte-ltd-,newstead-technologies-pte-ltd-,Singapore Armed Forces (SAF),Company Quarter Master Sergeant,Jun-15,May-16,"• In command of a team of 8 in the planning and facilitation of logistical support for training, fitness regimes and outfield exercises. • Managed 3 logistic stores and achieved zero discrepancies and observations in Logistics Audit Board supply audit for work year 2015.",,https://www.linkedin.com/company/singapore-armed-forces-saf,singapore-armed-forces-saf,,,,,,,,,,,,,,,,,,,,,,,,,,,,,,,,,Singapore Management University,Bachelor of Science - BS,Information Systems,2017,2020,"Awards• Dean's List AY 2017/2018• Dean's List AY 2018/2019• Runner-Up Best Project IS 425 Digital Transformation Strategy with Tokio Marine Life Insurance SingaporeCo-Curricular Activities• SoundFoundry, Member• The Mentoring Circle 3rd Circle, Mentor","University of California, Berkeley, Haas School of Business",Summer Exchange Programme,,2018,2018,,,,,,,,"""Digital Innovation : 2, Data Science : 2, Web Application Development : 2, Project Management : 0, Machine Learning : 0, Data Visualization : 0, MySQL : 0, Python (Programming Language)                              Python (Programming Language) : 0, JavaScript : 1, React.js : 0, PHP : 0, HTML : 0, Java : 0, Design Thinking : 1, Management : 0, """,,1,Information Technology & Services,18,"Ambrose Tan, Mark Tan Rong Jian",Ambrose Tan,Mark Rong Jian,"Harvard Business Review; Singapore Management University; University of California, Berkeley, Haas School of Business; SG:D Scholarship; Bill Gates; Linde",0,0,0,0,0.333333333,0,0.214285714,0.140625,0.354910714,0.019242085
154,Marketing Science & Analytics Intern at PHD Media | Business & Data Analyst | Master of IT in Business Analytics at SMU,https://media-exp1.licdn.com/dms/image/C5603AQGzTHW91rb9-g/profile-displayphoto-shrink_200_200/0?e=1589414400&v=beta&t=TAnpZ1JcdSTuKs3nMW8lzPjaIAK9HRGAgN67-DShoLE,Singapore,"I have a demonstrated history of working in the information technology and services industry. Skilled in consulting, production support, and service with applied knowledge.  Having worked with data, my interests have revolved around Operations Management, Business Strategy/Solutions and Organization Structure. I started looking at how businesses have realized the importance of utilizing big data analytics to maximize their profits, where actionable insights are derived from data related to both the organization as well as the industry. Data analytics is also required in order to maintain sustained growth of the business operations and to compete in the market in an era where the customers are flooded with ever-increasing choices. The major aspects of concern for any business is the speed and accuracy of making a business decision, and data analytics covers these concerns with ease as its principal of operation is based on the statistical modelling of data and usage of analytical tools to convert raw data into useful information. Through the same, I have come to appreciate business analytics as the backbone of success for any business and moving forth, I envision myself within the same sphere of decision makers who determine the tide of businesses across the globe.  Currently pursuing my Master’s degree in Analytics at SMU, I am open to opportunities that enable me to make use of data for innovation, optimization and solving real, large scale issues in the analytics field which in turn facilitates game changing business decisions.  Outside of work and studies, I am very much passionate about digital art, and I manage an online art gallery in DeviantART. I am also interested in video games, the genre being MOBA and RTS.  You can contact me directly at karthikn.2019@mitb.smu.edu.sg. (or) karthik.nityanand@gmail.com.",PHD,Marketing Science & Analytics Intern,Jan-20,Mar-20,,Singapore,https://www.linkedin.com/company/phd-,phd-,Kaar Technologies,Associate Technical Consultant,Nov-17,Jun-19,"• Evaluate, Design and Implement SAP Enterprise Solution for clients in varied industries such as Financial Services, Oil & Petroleum, Constructing Solutions and Industrial Manufacturing • Identified and tested SAP business process controls in collaboration with HCM, FI, SD, MM and PM consultants to satisfy business objectives and to overcome problems. • Wrote, designed and produced Functional Specification Document and Technical Design Documents after requirement analysis. • Improved technical processes, performed analysis of code and implemented background programs using SAP FIORI, ABAP Reports, Workflows, Enhancements, BADI, Forms, Scripts, BAPI/BDC, JAVA API and PI/PO (in the HCM/FI/SD/MM Modules). • Operated on VAT implementation for several companies in KSA in record time of 7 seven weeks. • Implemented Fiori apps (both standard and custom) for HCM Module and collaborated with HR users for 6000+ employees. • Regulated 24*7 critical post go-live technical support for client SAP systems. see less",India,https://www.linkedin.com/company/kaar-technologies-pvt-ltd-,kaar-technologies-pvt-ltd-,Kaar Technologies,Graduate Engineer,Aug-17,Oct-17,"• Worked as a part of offshore technical team for KSA East region handling requirement gathering from onsite, analysis of report and administering suitable technical solutions • Organized an end-to-end business cycle case study for the entire batch of Graduate Engineer Trainees ensuring the entire business process protocol is understood whilst suggesting locations where SAP systems can be employed for Business Process Management • Entrusted with the responsibility of Support Coordinator for clients in Kingdom of Saudi Arabia East region at Kaar Technologies. Tasked with the process of managing various service requests to ensure proper functioning of the software deployed to the production system. see less",India,https://www.linkedin.com/company/kaar-technologies-pvt-ltd-,kaar-technologies-pvt-ltd-,"DeviantArt, Inc.",Freelance Digital Artist,Dec-14,Jul-17,"Digital art is like painting, except the paint never dries. Check out my Art Gallery over here - https://www.deviantart.com/arthaselric",India,https://www.linkedin.com/company/deviantart-inc.,deviantart-inc.,,,,,,,,,,,,,,,,,,,,,,,,,Singapore Management University,"Master of IT in Business - Analytics, Masters",,2019,2020,"Courses enrolled in:• Data Analytics Lab (SAS Enterprise Miner, SAS JMP Pro)• Applied Statistical Analysis with R• Spreadsheet Modelling (Advanced Excel)• Visual Analytics & Applications (Tableau, R Studio, Shiny)• Internet of Things• Digital Banking and FinTech",Jeppiaar Engineering College,Bachelor of Engineering - BE,Electrical and Electronics Engineering,2013,2017,,,,,,,,"""Python : 0, SQL : 0, Microsoft Excel : 0, Data Analysis : 0, Data Modeling : 0, R : 0, Tableau : 0, Microsoft PowerPoint : 0, ABAP : 3, SAP ERP : 3, HTML : 0, C++ : 0, C : 0, SAS Enterprise Miner : 0, Microsoft Power BI : 0, Teamwork : 1, Customer Service : 0, Team Management : 0, Public Speaking : 0, Leadership : 0, SAS JMP Pro : 0, ABAP-OO : 3, ABAP Web Dynpro : 2, SAP Workflow : 3, Sap Fiori : 3, Digital Art : 0, """,,1,Information Technology & Services,13,"Cher Boon Sim, Liu Zuo Lin",Cher Sim,Liu Lin,Amazon; Forbes; SMU MITB August 2019 Intake; Gary Vaynerchuk; Kaar Technologies; The Economist,0,0,1,0,0,0,0.214285714,0.09375,0.308035714,0.293409351
