username,num_posts,date_posted,date_experienced,rating,review_title,review_textallspice502016,935,Nov 2016,October 2016,40,Peranakan’s Rich Culture,"Peranakan Chinese or Straits-born Chinese are the descendants of Chinese immigrants (from the 15th &amp; 16th centuries) who came to the Malay Archipelago. They adopted the term ""Peranakan"" to distinguish themselves from the new immigrants. The male descendants were called Babas and female descendants Nyonyas. Some of the Nyonyas still wear their traditional costumes called the Kebaya which is a beautiful, translucent, figure-hugging embroidered blouse worn with a batik sarong.This museum specializes in Peranakan culture and displays a comprehensive understanding of Peranakan traditions, from traditional wedding ceremonies, to displays of traditional needlework and beadwork. The museum is housed in the former Tao Nan Chinese School built in 1912. A small museum but packs in a lot of interesting exhibits."
jazzyuppie,24,Nov 2016,November 2016,50,Insightful trip on peranakan culture,"It a small museum as compared to Singapore national museum. The volunteer guide, who is a peranakan baba, is very knowledgeable on culture. We spent a good 2 hours listening to his explanation."
Jacqueline B,41,Nov 2016,September 2016,50,Beautiful,Visited this museum one Sunday morning.  It has a lovely collection to look at and the staff are very helpful.  Give yourself a couple of hours to look around
B809THpaull,31,Nov 2016,October 2016,50,Learn about the rich culture of Singapore,"If you are not a museum person, this is the museum for you.   In about one hour you can browse the collection of all things Peranakan...artifacts, furniture, jewelry and learn about all aspects of Peranakan life.   Interesting from start to finish...well worth it, as I do not think there is another place like it."
AllyJane,222,Nov 2016,October 2016,50,Charming and rich,"This is simply a charming museum! Housed in a delightful building over three floors, the s slightly tucked away the Peranakan Museum showcases the culture of the Peranakan communities.  The wedding collection is particularly of interest.  The needlework exhibition demonstrates a colour part of the Peranakan culture.  Easy to see why this museum rates so highly by fellow travellers!"
Chris P,308,Nov 2016,October 2016,40,Small but interesting museum,Small and compact museum spread over several floors. The place gives a good insight in to the different Peranakan origins as well as early life in Singapore. IT doesn't take too long to see all the exhibits so worthwhile swinging  by if in the area.
Elisheva2012,11,Oct 2016,October 2016,50,OMG! A new MUST!,"I admit this museum sounded like it was not going to make the to see list. There is too much to do and I am here for a conference. Also, who knows what Perenakans is or are? However, walking from one place to another, I saw it and walked in (no charge!!!!). The museum focuses on the artisan work of the Peranakans. The term refers to individuals of mixed Chinese and Malay heritage. They do the  most amazing bead and embroidery work. Truly humbling, colorful creative and exquisite. The museum also includes wonderful displays of clothes and furniture. Clothes are placed on dummies with explanations as to the purpose and nature. Furniture is arranged by type and purpose of room. For example, there is an amazing table set in beautiful local china. There are a set of figures representing a wedding march. There are also ""touchy-feely"" boxes where you can feel how certain fabrics or wood carvings feel.  Videos with interviews of current artisans of bead work are integrated in the exhibits. etc. Truly a wonderful experience and child friendly as  well. I did not see elevators, so watch out for the stairs."
Erica C,47,Oct 2016,October 2016,30,Interesting place to know more about Malaysian Chinese,"I was introduced by Tourisum centre at Chinatown. I walked from Chinatown Backpacker. According to Google map, it was not far away around 20 mins.  At last I used 35 mins, may be walking slow. The museum is free if charge. 3 storeys high elegance building. I like this type if building much. Exhibition room were great, full of collection, handmade sewing, household wares. If you are interested to know more about the life of Malaysian Chinese, you should come. They have a lot of things for you to see and touch."
wihte_sandy_beach,43,Oct 2016,August 2016,50,Small but rich with valuable things,"Superb! Lots of exquisite stuffs from Straight Chinese families last time. This is a small museum, however it is rich with valuable things. Even the building reminds one to Straight Chinese house in the past.<br/><br/>There is a corner with olden days kitchen display and voice recorder that helps one to imagine how it feels like in a kitchen back then. And also displays of delicate elaborate handicrafts of Straight Chinese ladies."
tot2trish,81,Oct 2016,April 2016,40,Informative insight into indigenous culture,"Peranakans are native-born people of mixed local and foreign ancestry. Peranakan culture is described as a blend of two cultures where the people are ethnic Chinese but culture and language are predominantly Malay-influenced.  The Peranakan Museum is worthwhile to visit, if one wishes to learn about the local people who make up a good proportion of Singapore.  There were interactive exhibits when I was there which involved locating a dozen different symbols (such as dragon, phoenix, floral designs, etc.) matched to exhibits, then embossing the symbol on a color wheel on paper provided by the museum docents.  It was fun as well as educational.  Learning about famous Peranakans and seeing some of their handiwork was interesting.  The museum is three stories, but there's an elevator (or lift) available for those with mobility issues or young children in strollers."
Rachel_PRL,"1,175",Oct 2016,November 2015,40,Best museum in Singapore. ,"Very unique museum dedicated to local culture. It is a very small museum housed in three storey shop houses. I went there quite some times ago when there was a Peranakan Jewelry exhibition, which are all pure gold with elaborate &amp; very beautiful design."
Charlotte G,48,Oct 2016,February 2016,50,My favourite museeum,"This is the cutest, nicest and most genuine museum I've ever visited. It's small enough to go through in one day. Full of information about the peranakan culture and history. Cannot recommend enough."
Jeebak_Roy,116,Oct 2016,October 2016,50,A wonderful glance into the rich past,"A well maintained and tight security museum,with an astonishing and astounding collection of the Peranakan family and civilisation. Worth visiting."
Anna R,571,Oct 2016,September 2016,40,Great insight into Peranakan culture,"The Peranakan Museum is a must for tourists who want to learn more about the history and culture of Singapore. <br/>To make the most of the museum, make sure you take a free guided tour (available at least twice a day at 11 am and 2 pm, and some days also at 12.30). The tours are run by volunteers of Peranakan background and take about 1 hour. <br/>Our guide was excellent: knowledgeable, entertaining and a great story teller. Also, take a look at the tiny gift shop near the entrance, selling genuine Peranakan crafts and souvenirs: the shop it is so small I nearly missed it...<br/>And if you are interested in crafts, the incredibly intricate Peranakan beadwork has to be seen to be believed."
HesterCalkhoven,19,Oct 2016,May 2016,50,My favourite museum in Singapore,"A small but very authentic museum in Singapore. It will give you, within half an hour to an hour, a very good impression on how Singapore came to be."
Jon S,65,Oct 2016,October 2016,20,Very disappointed,"Probably not the fault of the museum, but due to extensive renovations, there were virtually no exhibits. Better to close than give high expectations, only to led the viewer down."
Chris Mundy,215,Oct 2016,October 2016,40,Gave me a great background of some of the people groups of Singapore,"I went with a local and a friend to check out the museum.<br/><br/>I learnt a lot about the Peranakan people and their place in the formation of Singapore.<br/><br/>This place gave me a greater appreciation of the people their art and customs.<br/><br/>If you're interested in local history, put this on your list."
Khin Q,366,Oct 2016,December 2015,50,Fascinating museum,"Even for locals.  The Peranakan history is rich, colourful and interesting and you get to read about Peranakan who had played an important role in Singapore's history and development."
Rod Valenta,85,Sep 2016,September 2016,40,Intricate Needlework,"Visiting this museum was a highlight of my visit to Singapore - luckily I saw an advertisement on the back of a bus that enticed me in!<br/>The building itself is just beautiful, and houses displays of the Peranakan people's culture, art, and every day life objects. I found it fascinating.<br/>There are 9 galleries over three levels covering everything from origins, food &amp; feasting, language &amp; fashion, religion, weddings and public life. There is a lift, but the stairwell is beautiful.<br/>Until the end of March 2017 there is a special exhibition of Nyonya needlework which is the most amazing display of intricate embroidery and beadwork. Some of the works were from the permanent display, while others were on loan, and they were all incredible and well worth seeing. The colours and lustre of the silk threads were beautiful."
Allyjet,69,Sep 2016,November 2015,40,Interesting museum that gives good insight in local culture and Heritage,"Took my parents to see this museum. Was very nice and informative. I had heard of Peranakan of course, but did not quite catch it until I visited this museum. Beautiful building and cute little giftshop. The small coffeebar is too expensive and does not have much to chose from unfortunately."
lena975,92,Sep 2016,August 2016,50,A view into the fascinating Peranakan life!,"As a Peranakan myself, this museum helped me to understand a lot about the Peranakan culture, way of life, food, customs, etc. Some of the things I've been doing or eating or saying are so in-built in me that I did not give a thought to how they came about or what it's real function is for - this museum gave me more insight into my own culture!"
EaglevisionLowe,278,Sep 2016,October 2015,50,Visit with fellow Rotarians,Excellent museum collection of Straits Chinese artifacts showcasing the history and living culture of these early residents of Singapore and Malaysia.
Susan R,30,Sep 2016,September 2016,50,A historical cultural reference,"Housed in a old school building with terraces &amp; shutters beautifully presented glimpse into a culture that was old Singapore.loved the beadwork,embroidery, jewellery."
Alexvonw,179,Sep 2016,March 2016,50,What Singapore is really,"Trying to actually nail down Singaporean culture is quite difficult but this museum does quite a good job explaining Peranakan culture which is arguably the real 'Singaporean culture'. I wouldn't recommend it for kids but students and adults will find it engaging for an hour or two as there are old artefacts and stories, plus contemporary displays."
Tracey K,49,Sep 2016,November 2015,50,Interesting museum,This is my favourite of all the museums here in Singapore.  It is not too big and it is really well laid out.  It's a lovely building too.
markrabjohns,275,Sep 2016,September 2016,40,Interesting history of Straits Chinese,"We spent an enjoyable hour and a half in this beautifully restored Chinese school building, learning about the heritage, culture and tradition of the Peranakan people's in the South East Asia region. <br/><br/>Educational and interesting. Well worth a visit."
Yvonne C,71,Sep 2016,November 2015,40,Great insight into Straits Chinese culture,"Despite being such a small and relatively young country, I applaud Singapore's efforts at building its cultural hubs - and the Peranakan Museum is one of them. Peranakan is a word used to refer to Straits Chinese Singaporeans/Malaysians - essentially Chinese people who have adopted Malay customs through intermarriage or just by culture assimilation (given that this area of Malaya/Indonesia tend to be primarily Javanese/Malay in ethnicity). It's a great way to see how these cultures have assimilated and for tourists to understand that race can be a fluid concept for us here in this part of the world. Highly recommended."
smiley98,37,Sep 2016,September 2016,50,A little gem in Singapore,This museum is a little gem.   I took part in a small guided tour which was very interesting and informative.   There are several interactive areas and would be interesting to children too   The exhibits are carefully displayed and it is interesting to follow that period of history.   A great couples of hours spent in the Museum Highly recommended
Stephanie N,185,Sep 2016,August 2016,40,Very Interesting Full of History,"Fantastic museum full of so much information and history. I really enjoyed learning about their culture and customs. There are about 3 levels showing life, history, needlework, home life, marriage and death. There are interactive sections for kids including craft. For $10 it is excellent value. It is easy to get to via public transport. They have clean bathroom facilities as well. Air conditioning gets a bit cold so bring a jumper."
Suthatta S,90,Sep 2016,September 2016,50,Love this place! ,Great presentation helps us to learn more about Peranakan :) The fees is only S$10 for foreigner adult! Dun miss the needle workshop~ it is impressive! What a handicraft project and working hours!
Greg L,"1,013",Sep 2016,September 2016,50,Must visit ,Fascinating on history and how weddings were so important.  Be sure to get the free tour guide. Lots of info she shared with our group. Well done museum and good price
AugustoMonteverdi,169,Sep 2016,August 2016,30,"Ambitious, but Misses the Mark","The museum made a valiant attempt to define ""peranakan"" in a broad, general, and almost literal term; however, the message seems to shift as you make your way through the galleries.  In the end, I find the original message and definition that were offered when you enter the museum have been undermined completely.<br/><br/>I understand the desire to expand the definition of peranakan to include the different ethnic groups and to present a harmonious and wholesome view of the heritage of Singapore that reflects the cultural make up of today's Singapore.  I suppose that is the purpose of the series of large photographs of peranakan Singaporeans of different ages, most of them credited with a pretentious and/or ambiguous statement about what it means to be peranakan.  It was almost a breath of fresh air when I came to the photograph of a man credited with saying he does not ""feel""  peranakan; he just feels--or something to that effect.<br/><br/>Beyond the first galleries, the exhibits limited their focus completely to the Chinese peranakan, specifically the Hokkien (Fujian) peranakan--probably the predominant peranakan group in Singapore.  While it was interesting to see objects in the exhibit--wedding and funerary objects, clothing, dinner ware--I kept thinking about the central theme presented in the first gallery:  What is a peranakan?   I do not think those objects are what make one a Hokkien peranakan, let alone a general peranakan.  <br/><br/>Ultimately for me, the lack of exploration of the ""why's"" --to use a simple example:  Why did a young Fujianese woman suddenly decide that it was a good idea to wear sarong and kebaya?--makes the experience feel utterly incomplete and superficial."
Helen M,13,Sep 2016,July 2016,50,Wonderful display of Singapore's history,I was lucky enough to catch the Nyonya Needlework exhibition and it was amazing. This intimate museum shows the colourful daily lives of the Peranakan culture.
Coral M,14,Aug 2016,August 2016,50,A Look into Singapore's Interesting Heritage,"We were fortunate to arrive just before 2 pm and joined a tour led by Joan. What a wonderful guide, a forth generation Peranakan who led us through how the original local women formed partnerships with sailors and traders from mainly China and India forming the unique culture called Pernanakan. Over three floors of interesting exhibits. A wonderful experience."
Roseocean,81,Aug 2016,September 2015,50,History at its finest.,"To understand the word Peranakan you need to come see how the two cultures became one.  The traditions both shared were very well married into the people that we now use one word to describe. The dress, furniture, and lifestyle are visible and each has a fantastic explanation of why things are  the way we now see. The beliefs system and values carried the traditions that help us understand the culture. If you love history this is a place for you."
Dan M,12,Aug 2016,August 2016,50,This museum is worth visiting,Exquisite and fascinating items presented beautifully to provide a wonderful glimpse into the past lives of the Peranakans.
diannebateman770,43,Aug 2016,August 2016,50,Peranakan Museum,"Just do it!  If you like finding out how a civilisation grew out of the melting pot.  Take a look at his museum, I thought it was great"
Laura B,24,Aug 2016,August 2016,50,Interesting place with tons of stories!,"A really lovely museum.  This place tells you all about the history of Peranakan people and their life.  I didn't know much about the subject before but this museum makes it really easy to understand.  It is understated but informative and interesting. <br/><br/>I loved the embroidery exhibition, and also the marriage exhibition.  The addition of visual aids such as videos was really good.  <br/><br/>I would definitely recommend a visit here."
perrin99,131,Aug 2016,August 2016,40,Small museum housed in beautiful buidilng,Great insights into the Peranakan history.  Wonderful way to spend the afternoon.  The guided tour in english was included in the price of out tickets.
Pippilotta111,32,Aug 2016,August 2016,50,Beautiful museum,"The museum is housed in a beautiful building inside as well as outside. There was an exhibition of the embroideries of the Peranakan women and I have never seen anything like it. These women were real artists and they paint with beads and silk. The colour combinations are extraordinay and their expertise is amazing. All aspects of their life are represented in the museum like religion, marriage, cooking and furniture. These women had a style of their own and were educated as well and they loved beautiful objects. There is also a good shop next to the museum with lovely books."
ToleTravellers,59,Aug 2016,August 2016,40,Interesting history museum housed in a beautiful colonial building,"An excellent introduction into the history and culture of the Peranakan people. Our guide was knowledgeable, passionate interesting and engaging. She explained the history through the significant displays and artifacts. We were fortunate to visit during the Nonya Embroidery and Beadwork exhibition."
roadtrippernineteen,256,Aug 2016,August 2016,50,Gorgeous Museum full of straits history,Ensure you do the tour! It's a lovely museum seeped in history. Walking around without the tour one must read the signs to appreciate the nonya peranakan culture.
Levinia C,34,Aug 2016,August 2016,50,"Beautiful beading and needle work, well worth a visit and easy to get to",Visited this museum for the first time today. Don't know why I've not been before. Like all museums very reasonable entry fee and very cheap for seniors.<br/>If you do come pick u the wheel at the entry desk and you can take impression from presses at many of the exhibits. Life to the top and walk down. Set aside 2 hours. You can rush round in less and send more.
SimoneSMC,77,Aug 2016,July 2016,40,Fascinating museum,"A small cute museum tucked in a small lane called Armenian Street near the Hill Street fire station. I'll recommend that you visit if you're in town for a few days and want to know about the history of the Straits Chinese in the south east Asian region. Prior to the British colony days, Singapore was already an important port of call for international traders including the Chinese. The intermarriage between the indigenous peoples with the Chinese and even Indians (perhaps less represented in SG mainstream media) produced the Straits Chinese and peranakans.<br/><br/>I stayed two hours here in all. The artifacts are not as many as I'd thought would be collected so I'm somewhat disappointed. I think the important facet of peranakan food could have been better displayed and presented. The display for the prominent peranakan VIPs was also awkwardly done up, with information panels all over the place and lacking in pictures. I had to crane my neck to read. If space is a premium the curators could use multi media to tell us a more coherent story. <br/><br/>Nevertheless if you're just looking to while away a hot afternoon and you've visited the bigger museums, this one could still be intriguing."
Samatswindn,42,Jul 2016,July 2016,50,A wonderful cultural experience...,"This museum is not large, but is on 3 floors (with lifts).   It is a presentation of the Peranakan culture, exhibiting antique homewares and the beautiful beadwork of the women; work so delicate that one wonders if it had caused them blindness.  On previous visits I was unaware of this little gem, but am so glad that I found it this time."
Monica K,6,Jul 2016,June 2016,50,Must see to understand the Peranakans,"I love visiting this museum because of the rich mix of antiques. They are all so beautifully crafted with stories behind it. If you are looking for beauty, hereit is."
M Nowell,25,Jul 2016,December 2015,40,Small but Interesting Museum,"We happened upon the Peranakan Museum. As foreigners, it was an introduction to an entirely new culture, which was fascinating. Even though the museum is a bit out-dated in most of its exhibits, it is pleasant to wander through and definitely a great introduction to Peranakan history."
Z K,26,Jul 2016,April 2016,40,Interesting aspect of Singapore history,"This small museum holds some interesting displays showing the history and culture of the Peranakan people - the original settlers who intermarried with the locals in Singapore. They are a diverse population because the settlers came from a range of places, China, India and the ME included. <br/>I would recommend taking the tour which is run by volunteers, to make better sense of the displays. Then I would recommend having a Peranakan meal to complete the experience!"
JulieLimSY,157,Jul 2016,July 2016,40,Good,"It was a well spent one and a half hours for me.  Really interesting exhibits on the life and culture of the Peranakans.  Free admission for Singaporeans and PRs.  <br/><br/>I particularly liked the exhibits on Peranakan weddings, and also the barrister wigs of both Mr and Mrs Lee Kuan Yew that were on display. <br/><br/>I paid $4 for entry to the special exhibition on Peranakan beadwork which was so worth it as that took up about one third of the exhibition in the whole museum.  <br/><br/>A must see for tourists and Singaporeans."
whatu1,463,Jul 2016,December 2015,40,Many familiar local faces spotted,Many children enjoy walking around the museum to stamp on their visitor card while the adults get to view the many artefacts contributed by prominent Peranakans.
kim buay p,"7,425",Jul 2016,June 2016,50,Very pretty new handicrafts from Penang and Indonesia,There is a new section showing the Peranakan culture from Penang and Indonesia which is definitely worth a visit.<br/>It is just amazing and admirable to see all the intricate details in the Peranakan clothings which was sewn by hands long ago.<br/>The amount of exhibits is just sufficient to be enjoyed on one visit without feeling overwhelmed.
Jason G,51,Jul 2016,April 2016,40,I didn't know what Peranakan meant when I visited.  Now I know!,As a US traveler I knew next to noting about Peranakan culture and history and now have an appreciation for an important part of Singaporean culture.  The exhibits are beautiful and there are a lot of them but I didn't feel like I needed more than an hour or two to follow along on the tour and view the displays.
