username,num_posts,date_posted,date_experienced,rating,review_title,review_text
fiz S,71,5 Mar,March 2020,50,Perr-Aaa-Nak-Kan - A must to visit,A must to drop in. RM20 per person regardless local or non-local. But for RM20 it is definitely worth it. <br/><br/>Very intricate design of both the structure of the mansion and all its hidden gem. Will take you back to the 18th Century thru its precious antiques and historical photos. There are various elements of fusion between east meets west embedded in design of furnitures etc.<br/><br/>Time spent: 30 minutes up to 1 hour +<br/>Pay a little bit more attention on the details and you can see some hidden symbolism. <br/><br/>A must to drop in
Lynette M,7,Oct 2019,November 2018,40,"Explores the beliefs, culture and traditions of this important group in Singapore.","The museum explains the origin of the Peranakan culture. It was thoughtfully arranged with period exhibits and explored the groups beliefs, traditions and lifestyle. I found it very informative and well worth visiting."
ContinentsExplorer,816,Oct 2019,September 2019,40,Walking Tour in the heart of financial (central) district,Interesting walking trail to discover the Peranakan and different Chinese cultures and heritage. Museum is tacked away in the heart of the financial district. Artistic pieces (original) and option of replica design. Very limited street parking.
CHIDUWIN TV,627,Aug 2019,January 2019,30,Malaysian Museum,"Malaysian cultural museum. The museum has a huge collection of dresses and utensils and pictures, which poteays the detailed life of Malaysian Culture."
EmO,14,Aug 2019,August 2019,30,Beautiful but not for young children.,"Beautifully laid out and well maintained stately house. A lot to be learnt about the culture and heritage of the area. I think you could spend a long time here but with young children  it was hard and very hot inside, due to layout. <br/>It's reasonably priced though and the staff are helpful and friendly."
phi12017,102,May 2019,April 2019,40,Takes you back to a time long past -- a visual image of cultural intermingling of Chinese and Malays,"The term ""Peranakan"" is used in Indonesia, Malaysia and Singapore to refer to persons born in these countries of mixed local and foreign ancestry. “Foreign” could be  Arab, Chinese, Dutch, Indian, etc. Thus, the museum deals with artifacts and events associated with some form of foreign ancestry, in one way or another.<br/><br/>Because this museum was then  going to be closed very soon for rennovations,  I joined a group of six people visiting the museum in early April. The exhibits  revealed to me at least,  in a sparing way how some of the immigrant Chinese embraced and in a sense made their own, some of the practices of the indigenous Malays. They were also pictures of some former British colonial officers. <br/><br/>What emerged from the collection of exhibits is a revealing history of the not too distant past and the coming close to each other, or, even of the intermingling of some Asian cultures,  laced with European or British influences, on the fringes.  A visit to this museum is worth every minute spent to behold the varied collections of events, individuals, objects, etc.<br/><br/>All the pictures  are of exhibits on display in the museum and the copyright is with the Peranakan Museum or the actual owners of the exhibits, if  indeed they are on loan to the Museum."
JaR1983,204,Apr 2019,February 2019,50,A fascinating cultural experience,Ignorantly we knew nothing about the Peranakan culture but this museum was so interesting and gave superb examples of people's lives. Particularly liked the photographs. We followed the experience with a meal in a Peranakan restaurant. A superb day!
Mum0fTwo,106,Apr 2019,March 2019,50,Worth the visit,5 minutes walk from Bras Basah MRT station. Lots of interesting exhibits. Beautiful costumes and traditional garments on display. You can even dress up and take pictures. My 8 year old son learnt a lot about the Peranakan culture. Friendly and helpful staff. Toilets were very clean too. Glad I took my family here.
DW@Ballarat,"1,116",Apr 2019,March 2019,50,Excellent cultural heritage museum - pity its just closed for renovations,"This fascinating and well presented museum spread over three floors explains the heritage of Singapore with a mix of visual art, old furnishings, costumes, photographs and mocked up rooms. When it reopens take the opportunity to join a one hour guided tour of the museum as this will  add to your enjoyment of the museum."
mxgiosisca,37,Mar 2019,March 2019,40,Closing down for revamp from 2019,"Was my 2nd visit, and it was an enjoyable, peaceful time. Glad to hear they're not closing down for good, as they will be revamping content until 2021. The displays were well curated, and easy to follow. I hope they continue to preserve the Peranakan heritage here on out."
Hans V,883,Mar 2019,March 2019,40,Cultural Heritage very well explained and displayed.,Cultural Heritage very well explained and displayed. Mama Malay Nonya based insight clarifying a big Chunk of the Cultural blend now dominated in Singapore and enabling the coexistence of diversity.
kshitijsathe,64,Mar 2019,February 2019,50,Good informative place,Great place to know the history of Singapore and the various cultures it blends. The sections are very informative and the overall maintenance is up to date. Its a bit costly around 13 SGD
ahliao,448,Mar 2019,March 2019,40,Small but detailed exhibits ,"Just 3 floors, considered not big. However, the exhibits and set up makes me feel connected and soothing.<br/><br/>Spend just 45 mins. Colourful, well organised/segregated, meaningful explanations.<br/><br/>Found yr time to explore!"
fionnechong,7,Mar 2019,October 2018,50,Family educational tour,There are so much we didn't know about peranakan culture.  Really eye opening.  My kids love the colours of the peranakan porcelains and their accessories.
DSK,172,Mar 2019,February 2019,50,A Historian's 'Must See',Beautifully laid out museum telling the Peranakan history and development up to the present day. Friendly and efficient staff
Secret_Possum,353,Mar 2019,January 2019,40,Potted reconnection with Peranakan roots,"The concept of Peranakan culture is difficult to explain, so a trip to the Peranakan Museum was in order for my foreign-born princess. <br/><br/>Housed in what was an old school building, the Peranakan Museum was an easy - through sweaty - walk from the City Hall MRT station. Entry was a very affordable S$9 each (concession) for a senior and a student giving access to all the galleries, special exhibit Gambar (Malay word for photos) and a guided tour. We forwent the tour and decided to wander around by ourselves.<br/><br/>The exhibits were pretty static, housed as they were in glass cases or displayed behind roped off areas. The descriptions were illuminating, through this senior found the small font in the waist high plaques difficult to read, particularly in the diffuse lighting. <br/><br/>Despite this, they were fabulous props to explain Peranakan culture. And it was very evident that this museum is a labour of love and passion with a huge number of exhibits donated by prominent Peranakan families.<br/><br/>Our familial ties to Peranakan ways and culture are rather weak as the passion for the old ways was just not there, especially among the younger generations. The Great Grands, and Grands were tie-dyed Peranakan especially in their dressing and speech. But by my Mum’s generation, the women were all working for the then colonial British organisations, speaking English and in frocks and heels. No embroidered tops, sarongs and beaded slippers in sight!<br/><br/>A wander through the museum evoked waves of memories from my childhood of the rituals, customs, furniture, kitchen tools (like the huge granite spice grinders Grandmother used before the advent of the modern food processors), crockery, clothing, jewellery, accessories etc etc And also thoughts of “Hmmm I wonder what happened to Grandmother’s / Great-grand Aunty’s ... or I wonder who that was given to ....” plus, of course, “I have that, that and that ... from (this and that relative)” - all very precious, but impractical for everyday bar the most special occasions, unfortunately.<br/><br/>What I thought really well done was the display of the life cycle, from birth to weddings and funerals, which made it easier for princess to get a better understanding of Peranakan rituals.<br/><br/>This museum is well worth a few hours for those who would like an understanding of the term Peranakan and the history behind the unique Peranakan fusion cooking enjoyed throughout Singapore, Malaysia and Indonesia. <br/><br/>There is a tiny museum shop stuffed chock-full of Peranakan themed souvenirs beside the entrance if you want a momentous of your visit. We didn’t buy any as I have a small collection of authentic vintage items at home.<br/><br/>For those who would like to recreate authentic Peranakan dishes without the tedious hours of my great-grandmother’s and grandmother’s days, I suggest you seek out a copy of Modern Nonya cookbook by Sylvia Tan. This is the cookbook I refer to for authentic dishes simplified for the time-poor."
AKK1953,4,Feb 2019,February 2019,50,Hidden Gem,"Not highly advertised but this museum is a wonderful window into the Peranakan culture. Various galleries cover history, food, weddings and society. Really well laid out. Should be on the list of ‘must see’ museums for anyone with an interest in social history but is inviting and has plenty to offer the casual visitor. <br/>Current road construction work made it slightly difficult to find."
Kikka1931,260,Feb 2019,March 2018,50,"As a tourist/expat who likes to know more about the places you visit/live, you have to come here!","We went there with kids for an informative visit on the Peranakan culture - one of the most pervasive culture of this country - and we came out definitely satisfied!<br/><br/>LOCATION: it's in the city center, so easy to reach also with public transport (especially green/red line MRT). <br/><br/>PLACE: the building in which the museum resides was a school for more or less 100 years, so already this building sets the scene for what you are going to see inside. <br/><br/>EXPERIENCE: we knew it was possible to get a volunteer to guide our visit (please check on the internet the hours of the slots if you are interested) so we approached the staff at the desk on the groudfloor and they smilingly asked us to wait for a while at the designated area. Then after a few minutes the guide arrived and accompanied us in all the rooms, explaining the history and every-day life of this specific culture. Very nice indeed! Another very good feature was that the kids had their own maps where you could get stamps onto in each room: these kept the little folks entertained as we were!<br/><br/>TO SUM UP: if you are a person who likes to really explore the culture of the places you visit and not simply 'tick' areas.....this is one of the places to go!"
concorde7,110,Feb 2019,September 2018,40,Something different,This is quite different and also very informative.<br/>Nice and cool inside something that is welcome on a hot day in Singapore.<br/>You can spend a couple of hours before you know it.
James L,60,Jan 2019,January 2019,50,Informative,"Very nicely sectioned.  Day we went was not crowded, can browse at leisure within air-conditioned facility.  Recommend to visit museums in renovated mansions &amp; houses, along with this one.  Soak it all in."
LSL,120,Jan 2019,January 2019,50,Fascinating,Not your average museum. Another historical view of Singapore culture and diversity. Well laid out. Excellent exhibits. Worth going for a tour
patrizia l,288,Jan 2019,November 2018,50,Knowing the Culture - living between cultures,"This is a a beautiful and very interesting Museum about the diverse Peranakans. We met a lady in the Arab District in a shop house. She had wonderful artefacts in the shop. She introduced us to the Peranakan Culture and told us stories of her family and how they lived. The museum was her recommendation. It is in an old Shophouse on two or three levels. Grund floor with photos of the mix cultures of Peranakans. One family part coming from Malawian Background the other either European or Chinese. The Fusion of both worlds in education, beliefs, traditions is shown in many ways. It is a journey to a different world. We had the previledge to join a guide tour and we learned so much. Great Exhibition."
Penny C,32,Dec 2018,December 2018,50,A museum not to be missed,"What a lovely museum to visit, so interesting to know &amp; see the history &amp; the beaded shoes are just amazing.  Plenty to see &amp; do while there &amp; the gift shop downstairs to the right of the building when you exit is worth a visit too."
JennJenn C,45,Dec 2018,March 2018,50,A beautifully made Peranakan Museum,I just stroll around from Golden Mile complex heading to the Merlion Park. And passed by at this place. This is so nice not to be appreciated.
SDM88,102,Dec 2018,December 2018,50,Excellent highlights tour,"Visited on a weekend and joined one of the free highlight tours. Lots to see and a beautiful collection but really brought to life by Ian, our tour guide. He was brilliant! Well worth a visit"
Witoldzio,563,Nov 2018,November 2018,50,excellent,This is a museum devoted to Peranakan culture and all aspects of it. I liked the exhibits very much and the relaxing feel to the building. Very friendly staff. The exhibits focus on the customs and art of that ethnic group. Fascinating to be able to get an insight into the social and cultural fabric of Singapore.
angelinat202,75,Nov 2018,October 2018,50,Insightful and educational,"We had a most interesting afternoon going around the museum, learning about the history and cultural heritage of perankan culture. Such lovely and lively displays to show off such a great culture. A must visit for sure."
Kate A,32,Nov 2018,November 2018,40,For museum fans and/or those wanting to understand peranakan culture.,"Disappointed this cost more than the fabulous Asian Civilisation Museum, but beside that, definitely worth a visit. Gorgeous old building and rickety floor boards! The staff were helpful and friendly. <br/><br/>The actual displays were fabulous. My son learned a lot about funerals and weddings from the displays. I felt incredibly teary at the photos at the entrance. Such pride in one's culture is a beautiful thing. <br/><br/>A rich and well preserved photographic exhibition was on the 2nd and 3rd floors. Each photo gave a literal snap shot of life for the Peranakan in Singapore, Malaysia and Indonesia. Stretched from the early days of photography, all the way to the current era. The film showing the cleaning of some items was incredibly interesting. So much a labour of love."
Jhud69,76,Oct 2018,October 2018,50,A Delightful Quaint Museum full of Interesting Art and Artefacts of the Peranakan Era.,"The museum is housed in a delightful historical building and building, entry is by a small fee.  Inside the museum has a vast array of knowledge being shared on the well curated art, ceramics and furniture.  Everything has been well preserved and maintained. The old B/W photos of people add nostalgia whilst depicting life at the time. This museum i not glamorous like some attractions, but shines in it's simple beauty off the past."
lakshmi f,17,Oct 2018,October 2018,40,Wonderful corner of old Singapore ,"I had a few hours to kill in Singapore when I decided to visit this museum. <br/>It’s easy to find, despite the building works all around. The entrance is stunning , and the reception staff were welcoming. <br/>I enjoyed a glimpse into the various aspects of Peranakan life - I especially enjoyed pictures of people who speak of what their heritage means to them in 2018. <br/>The wedding and death rituals were very well curated and explained. <br/>I wa also impressed by the range of photographs from old Singapore, depicting the life and customs of Pernanakans from the 1800s. The collection of cameras was a treat !<br/>This museum is worth a visit."
Renaud M,204,Oct 2018,October 2018,40,Great dive in the history of the people of Singapore,"Very nice museum and excellent presentations on the origins and the ways of life of the people of Singapore. Great way to learn about the Peranakan and better understand why Singapore is such a cosmopolitan city! Worth a visit. Not too long and diverse presentations through videos, exhibits, photos. Don’t miss it!"
Belinda H,96,Oct 2018,October 2018,40,Comprehensive and interesting ,"Well set out in lovely old building. Good, well organised displays with helpful explanations. Air conditioned. Low entrance fee. Worth a visit."
Mazmannan,"9,057",Oct 2018,April 2018,40,Peranakan culture and history,"The Peranakan Museum is a must for all those who are interested in culture and history of Singapore. The museum is located in Armenian Street and is housed on three floors in a very beautiful building.<br/><br/>The culture and heritage of the Peranakan people is well documented in the museum. Everything from food, clothing, furniture, carpets, weddings, jewelry, and much more is there. The exhibits are well laid out and the descriptions are very good and easy to understand. <br/><br/>I found this museum very interesting - and time passed by very quickly. You should plan on spending between two to three hours.<br/><br/>I would recommend a visit to this museum.<br/><br/>The museum is open daily from 10am to 7pm. On Fridays, it is open from 10am to 9pm. Singaporeans and permanent residents go free. Foreigners and tourists admission fee is SGD10. On Fridays, from 7pm to 9pm the admission fee is SGD5. Senior citizens and elders pay SGD6 - and on Fridays pay SGD3 between 7pm and 9pm."
crullerpastry,20,Sep 2018,September 2018,50,A priority when visiting Singapore...,"I had an interest in the historical role of the Peranakan people in the growth of Singapore as a colonial trading port under British rule. This museum deals with that but is more interesting insofar as it explores the varied origins of the Peranakan, the emergence of their unique hybrid culture (e.g. wedding etiquette, food, furniture, etc) and their importance in Singaporean civil society. A fascinating museum with well curated and annotated exhibits. It's relatively inexpensive and, if you plan appropriately (which I didn't!), you can take advantage of the free guided tour. Worth checking out before you go. Conveniently located near City Hall MRT station. Bras Basah close if on Circle Line. Allow at least 1.5 hours."
Aprilflame,105,Sep 2018,August 2018,50,Wholesome view of the Peranakans,A must visit for those interested in the Peranakan culture and heritage.  Peranakan is often misunderstood to only represent those of mixed Chinese and Malay heritage i.e. the Baba and Nyonyas but the museum shows that it encompasses a wider group. It provides a wholesome showcase of daily lives and important ceremonies such as weddings and a funeral. An educational place to spend 2-3 hours on a sunny afternoon..
ianshamshey,907,Sep 2018,September 2018,40,very interesting-worth a visit!,"I was not aware of what the term ""Peranakan"" meant. In the past, Southeast Asia was an opportunity for trade and wealth and lured people to the area. Many stayed, married local women and the children of these unions are called Peranakans. Most are Chinese but could also be Arab, Eurasian and Indian. This museum details Peranakan art and objects and the various galleries outline their ethnic customs such as weddings, language and fashion, religion, public life and foods. It is very interesting to visit if you have the time. It is on three floors and there is an elevator for those who cannot negotiate the stairs"
little_peg,147,Sep 2018,September 2018,50,Amazing,"Singapore has people with different nationality living together. The child of local woman of singapore and other ethnic origins is called ""Peranakan"".  The museum gives me better understanding of Peranakans by guided tour and lots of exhibits,  not just watch them but can be touched. It is an incredible museum."
Jeanne H,130,Sep 2018,December 2017,40,Very good if you time your visit when a volunteer guide is present,"I personally prefer this Museum to our National Museum. Find the latter to be a bit overwhelming, too much text, though still worth visiting if you are interested in an in depth understanding of Singapore's history.  The Peranakan Museum is interesting mainly due to its content, the focus on the Peranakans, whose culture is  unique and an interesting combination of Malay and Chinese culture.  If you check the website, you can find out when the volunteer guides will be on hand.  From what I understand, they are usually Peranakans themselves, and so both knowledgeable and enthusiastic."
GeneralShamu,532,Sep 2018,August 2018,40,Worth a Visit History Wise,Very interested to learn about the history of the people of the Straits Settlements. Probably need 1.5 hours to see it all (max).
Gary D,630,Sep 2018,July 2018,40,Great insight into the Races of Singapore,"Really didn't understand the word Peranakan, and trip here clarified this for us. Well laid out Museum, in a resplendent old Building, with plenty to look at from the racial mixes, through displays of weddings, Fashion, Religion, Food and day to day living. <br/>Very comfortable to do in the heat of the day, well laid out and detailed.we are better informed now than prior to visiting. Worth a look if you have some interest in early singaporian life."
cyc326,35,Aug 2018,August 2018,40,good place to explore peranakan elements,"Had my last visit during the Night Festival 2018. A museum well preserved and telling stories of peranakan (historically mix of Chinese and Malay heritage). Had a corner at ground floor for visitors to take IG photos with the props available-- fun! Just beware of visiting the wedding rooms (level 1) with mannequins wearing traditional peranakan outfit at night time, as it could get a bit eerie (better to go at daytime?!)... overall, worth another visit when got longer time for the details."
Nancy P,476,Aug 2018,April 2018,50,Outstanding,"Fascinating history combined with beautiful furnishings and other samples of artistry make this our favorite museum so far.  We lucked upon this museum while attending a street festival, and were very happy we did.  The worksmanship ranging from beadwork to furniture details are lovely."
TheOExpress,"2,842",Aug 2018,August 2018,40,Take a tour if possible.,"The entry fee of SG$13 is best justified if you take a tour, which I did and lasted about an hour. In terms of the exhibits, many are stunning and really informative though I felt that the ‘weddings’ section was a little large when I would have liked to learn about other aspects of Peranakan culture. For example: the differences  between and similarities of the different groups. Still definitely worth visiting though, especially for the first room on the left when you go in, which covers the history and modern life of these communities"
KGB777,"38,048",Aug 2018,August 2018,40,Return to the Peranakan Museum,"We came back here for another visit after a gap of nearly 4 years. It's still free for Singaporeans and PRs and is well worth the effort of visiting. $13 for foreigners is a bit steep, but is perhaps worth it if you would like to get a better understanding of the Peranakan history of Singapore. Plenty of interesting exhibits to see here, although not that interesting for children."
vic10101,410,Aug 2018,August 2018,40,Worthwhile to those interested in Singaporean Chinese culture,"This is about the culture, customs and practices of Singaporean Chinese (Peranakan) including those married to other races. You need a good guide to explain to you the various stories connected with certain facets such as matrimony matters. But if you are not interested in these things, then the displays may not mean much to you."
FalconWix,13,Aug 2018,July 2018,40,Insightful,"Though it is only three stories high and not as big as compared to other museums, it provides a glimpse into the Peranakan culture within Singapore that has become less predominant today and allows one to appreciate the culture and heritage."
Ifan I,2,Aug 2018,August 2018,40,A fascinating place to celebrate diverseness and mixed culture,"The term peranakan itself embraces the cultural fact of living in Southeast Asia: you can't be racially pure, whatever that means. One is almost certain comes from a long line of mixed culture and heritages. Although mainly about Chinese settlers (as it was and is with Singapore), we can learn a lot about a peculiar mix of Chinese, Indian and Malay (and countless others such as Java, Bugis, Boyan/Bawean, Arabs, etc.) culture."
Grant R,103,Jul 2018,January 2018,40,Understanding this unique culture,I took my family to this and it was well worth the effort.  My primary school children were really interested in the how the older Singaporeans used to live.  The articles on display are brilliant.  The guide tried to make it sound as though all were Peranakan's were rich but this isn't quite true.  Nothing like telling the story how you wish it to be!.  But still very good.
BusinessBear,150,Jul 2018,July 2018,40,Good insight into the history of Peranakan,Located in fabulous old building the museum offers an insight into the history of the Peranakan. There are various themed displays across the 3 levels and is worth a visit
