username,num_posts,date_posted,date_experienced,rating,review_title,review_textgirleen,186,Sep 2013,June 2013,40,Great presentation on the Malay Straits Chinese culture.,"I really enjoyed learning about the Malay Straits Chinese culture - their traditions, furniture, food, weddings, furniture etc. They were often successful merchant families that intermarried and even at some point converted to Christianity. Really interesting slice of history and nicely presented. Eat next door at True Blue cuisine for a taste of their traditional food. Ask to see their gorgeous beaded shoe collection. Amazing!"
DonBosque,116,Sep 2013,September 2013,50,LEARN ABOUT AN UNKNOWN CULTURE,"This small museum, just around the corner from the YMCA, does an excellent job of educating about a little known sub-culture; that of the Malay Straits Chinese.   When the men of traditional southern Chinese trading families began to marry Malay women, something magic happened.    Go and learn about it, and you will learn how it shaped history and led to some new art forms."
AlanDDuncan,147,Sep 2013,September 2013,50,Delightful,"Great collection of beautiful and interesting artefacts from Singapore's history, laid out in nine themed galleries, each highlighting a different aspect of Peranakan culture. An excellent set of exhibits, with the narrative and history of the region brought to life. The emphasis on human stories and the melding of different cultures to form the hybrid Peranakan culture is fascinating and shows how people from diverse backgrounds can not only live together in harmony, but learn and grow together. At $6 entry, great value too."
740Elly48,443,Sep 2013,September 2013,40,History,Found this an excellent museum. We were fortunate enough to arrive in time for a guided tour which certainly further enlightened us on the life styles of the various groups who are Peranakans. The museum is well laid out and well wortth a visit.
JonofWilson,204,Sep 2013,September 2013,40,Interesting,A well laid out museum that gives an interesting history of the Peranakan people as well as their culture. Not far from the chaos of Orchard Rd it is well worth a visit. The tiny but beautiful shop is must before leaving.
Peter C,37,Sep 2013,August 2013,40,Singapore History,"I'm a history buff and spent around 6 hours visiting this place and the National Museum. Entrance to Peranakan is about S$5 and one is left alone to wander around the three floors of this old, but well maintained building. It focuses on life as the original Malay/Chinese lived in a few centuries ago."
Ckeong89,286,Sep 2013,August 2013,50,Good place to learn about Peranakans!,"Peranakans in Singapore were closely related to the development of Singapore and Malaya. So this is a good place not only learning about Peranakans but Singapore history too. This museum displays everything about Peranakans, from the origins, cultures, living style, customs, etc.. Grab a joint ticket to visit both Peranakans Museum and Asian Civilisation Museum at a discounted price. Get a puzzle at the counter and play the simple games during your visit and keep it as a souvenir. Some of the displayed items are provided for the tourists to touch and feel. Unlike the other museum which keep everything behind the glass."
JoForbes,"1,374",Sep 2013,September 2013,40,Visit the Peranakan Museum to learn about Singapore's cultural past,"Although the Peranakan Museum is located in the centre of the city, it is somewhat off the main tourist trail. A small but very interesting and probably one of the most colourful, the museum aims at explaining the rich and diverse  history of the Peranakans. Southeast Asia has long been a crossroads geographical and ethnically, opportunities of trade and commercial wealth has lured travellers here from distant lands. Many made their fortunes and left, but some stayed and put down roots, they married local women whose descendants are called Peranakans. The museum houses one of the world’s best collections of Peranakan objects, be awed by exquisite jewellery, beadwork, textiles, colourful ceramics and ornate furniture.<br/><br/>The museum is open Monday-Sunday 10.00am-7.00pm and Friday 10.00am-9.00pm. Singaporean citizens and PRs are free; otherwise adults are $6.00 and children free. On Friday evenings between 7.00pm-9.00pm there is discounted admission. There are guided tours available, but check the website to give timings.The museum is located a ten minute walk from City Hall MRT.<br/><br/>Next to the museum is a café to enjoy Peranakan cuisine and rest weary feet.<br/><br/>It would be good to combine this museum with a trip to Ba Ba House, which is a heritage home, which facilitates research and learning about the Peranakan community and its evolution. Be aware though that this museum is by appointment only.<br/><br/>So make sure you do spend an hour or two visiting this very visual and informative museum explaining about the Peranakan history and culture and how Singapore has become the diverse city it is today."
Lee San A,371,Sep 2013,August 2013,40,Understand Singapore Peranakan history and Have Fun,"Like this museum as you can understand the history. You can have a ""door Gift-Paper"". When you visit each station, you can use the mould and stamp on that ""paper"". Take you time in this museum and you may enjoy !"
Scot_On_Tour_10,48,Sep 2013,September 2013,40,Interesting insight,I arrived just in time for an informative guided tour of the museum - well worth it if you can manage it. The Peranakans are the descendants of mixed marriages between foreign traders and local Malay women. The museum concentrates on the Chinese Peranakans and gives you an insight into their culture and influence.
Tabby S,108,Sep 2013,August 2013,40,Throwing Clay Tablets from the Highest Floor!,"My friends and I decided to pop by the museum during the night festival. It was really crowded. The most interesting gimmick was being able to break things in the museum! Only the clay tablets, that is, at a mere SG$5 per pop. (Limited time only- not sure if it still runs) Totally unexpected crashes soon became the norm.  <br/><br/>Managed to see funeral- related things like tomb and mourning clothes.<br/><br/>Another strange thing was a black light room where lots of teens were scribbling on the walls with glow-in-the-dark markers.<br/><br/>Overall, an unexpected and fun museum trip! :)"
Ice-48,10,Sep 2013,September 2013,40,Great introduction to Peranakan history and culture,"I went to this museum on two occasions firstly during the night festival – it was packed and I didn’t really get a chance to look at things so thought I’d come back during the day. I’m glad I did, it is only a small museum and can be done in a relatively short period of time (there’s lots of places around it as well so you can spend a day in the area just exploring!).<br/><br/>I’d been told a fair bit about the Peranakan culture, but not so much about the history and although this museum only gives you a glance it’s a nice introduction to the culture. All the amazing beadwork items, clothes and pottery were beautiful to see! And for only S$6 who can say no! The first floor gives you an introduction to who Peranakan's are, the 2nd floor is all about the weddings (yes it needs a whole floor!), and finally the third floor has a little bit about other aspects, food, culture etc.<br/><br/>There are two tiny shops one has food and drink (best lemonade I’ve had in a long time in a jar). The second has general things you can buy, be warned when I say tiny I mean itty bitty!"
Mali_svetobeznici,60,Sep 2013,August 2013,50,Not to be missed!,"Should've visited this museum on our first day. However, even though we were extremely tired after several days of sightseeing I'm so glad we went. Very informative, learnt loads of the culture and history of Singapore and Malaysia. Some beautiful local embroidery that fascinated me as did the dining or wedding arrangements. <br/>If you are in a hurry, do make the mistake of running through it yourselves just reading the displays. BUT - if you have some time to spare - do get a guide. Our guide lady was excellent and she flooded us with first-hand knowledge about her people and customs.<br/>What is more, as we had our 2 kids with us (5&amp;7) I was surprised, the museum even had their own program for children. Kids got a a ""family treasures"" hunting wheel, on which they had several tasks to complete/find in the museum. Upon its completion they got a beautiful embossed stamp marking each step. Very well done. Kept them busy, they learnt a lot themselves from solving and reading the riddles and it kept us free to learn.<br/>Compared to the National Singapore Museum, if you have to choose just one museum to go to - this is the one.<br/>Highly recommend it."
Thung673,270,Sep 2013,October 2012,50,Little gem if you are interested in knowing more about the Peranakan,"the Peranakan museum is a beautiful museum for those interested in tracing back the origin of the Malay / indo/ chinese communities in Singapore, Indonesia, Malaysia, Thailand and the Philippines. Fascinating story telling in modern interactive displays in a historical building add to the charm of this museum. Easily spend up to 3-4 hours wandering its corridors and displays."
h2owitch,23,Sep 2013,August 2013,50,eye-opening,"Knowing about the Peranakan culture is essential to understanding Singapore and Malaysia. I learned a lot from it and if I were going back to Singapore, I'd visit the museum again.  The introductory exhibit which introduces the different branches of Peranakan peoples gives good preparation for the cultural exhibits to follow.  The explanations on earphones and screens were important to understanding what was displayed, although you could enjoy the displays on their own.  Sometimes there was a wait because another person was using the earphones.  <br/>An elevator is available for those who have difficulty with stairs.  The small attached gift shop has a variety of beautiful items, including several Peranakan cookbooks."
Bernee2013,136,Sep 2013,July 2013,40,An excellent Museum!,It was great to find out a bit more about the Peranakan culture. Loved the building and all the things on display in it. An easy walk from City Hall MRT and quite near to the Singapore Art Museum which could be visited at the same time.
Stefranconeri,10,Sep 2013,September 2013,50,Full immersion!,This should be your first stop in Singapore if you want to learn all about the local culture. The experience is like a travel in the past and it will make you look at Singapore with different eyes! The entrance is 6 Singapore $ and you will need at least a couple of hours to visit the museum. There are restaurants and coffee shops around to keep you going.
Olga G,806,Aug 2013,March 2013,50,Singapore history,"Being from another side of the world I didn´t know to much about Singapore history. This museum helped a lot. Very good quality, interesting and interactive exposition. Friendly staff.<br/>I higly recommend it!"
Sandra B,18,Aug 2013,August 2013,40,Allow at least 2 hours,I learned so much about the Peranakan culture and Singapore. It was very interesting and I would highly recommend it. Allow at least 2 hours.
Heather B,159,Aug 2013,August 2013,50,Best Museum to visit in Singapore,The museum is small enough to visit in about an hour but gives you a real understanding of Peranakan history in Singapore.<br/>The guided tours are excellent and very interesting.  there are plenty of hands on activities to keep children occupied.
budgy26,233,Aug 2013,July 2013,50,Absolutely Wonderful,"Attractively designed, full of information without being boring ! History blends with mixed cultures and they came alive in this museum and even more vivid with our guide : Joan. It is interesting to witness the wedding ceremony of Peranakan Chinese mix, - don't miss to note the raw pig leg as the offering from the groom family to the bride's and what it symbolises; the progression of their traditional kebaya. For entrance fee of only $6; you will not regret visiting this museum."
Jan G,12,Aug 2013,March 2013,40,Step into a enchanting culture,"The peranakan museum is housed at the Old Tao Nan school( my beloved sch) and houses a collection of jewelry, costumes, household items and intricate embroidery. <br/>I love how each piece of history vividly recreates a time long past, of a lifestyle devoted to excellent cooking, hospitality and craftsmanship. <br/>Absolutely worth a visit though its a very tiny place."
SnowmanSnipe,147,Aug 2013,July 2013,50,Cultural and enlightening,"This is a beautiful museum - small in size but contains fascinating exhibits. My grandmother is Peranakan but so much of our roots and traditions are diluted. Visiting this museum struck a chord in my heart. The exhibits are well organized- from origins of peranakan people to the marriage rites, to clothes, items used, dining traditions, funeral rites etc. It's a great place to while away a hot Saturday afternoon. There is no Admission fee for locals but an admission fee of sgd6 is imposed on tourists. There is a quaint cafe outside and of course a gift shop for souvenirs!"
Don P,"14,531",Aug 2013,August 2013,40,Very nicely done focus on Peranakan culture and life,Small museum focused on Peranakan culture and lifestyle and it provides good information and insight.  Very enjoyable museum to learn about the Peranakan mixed culture that developed and evolved and what some of their every day life was like.
Kala R,342,Aug 2013,August 2013,50,entering the world of Peranankans,"today I visited the museum at Armenian street,close to the Canning rise and the singapore Philatelic Museum.<br/>Peranankan museum has three levels of exhibits.<br/>lets start at ground level.it says all about the definition of Who is a Peranankan.<br/>then it has beautiful depiction of how the names have come which people take on.<br/>then there is religion,food and feasting,the cultures.<br/>the wedding gallery was the best.It has huge exhibits of furniture ,jewellery and the clothes to be given away to a bride.<br/>It also showcases the origin of all these items.<br/>there are huge cabinets,red and gold,jewellery in gold and silver,unthinkable in modern days.<br/>the objects are well documented,well preserved.good lighting and music.clear guidance as to how the food is served in Noynaware.I took several pictures.I love to see museums,because tht is the only place where we can conenct with our past and also our heritage.must see.keep enough time to go around the place."
SihYing,58,Aug 2013,August 2013,40,a special taste of Singapore - the Peranakan style!,"This is a very unique presentation of a race in Singapore - the Straitsborn Chinese. <br/><br/>Come and experience this very special blend of Singapore and experience the tastes, cuisines, cultures and traditions of this very special group of people.<br/><br/>Come and watch the video presentation which clearly explains the meaning of the word Peranakan and it shows the origins of the ancestors of this community - some Peranakans have roots in Europe and Asia and some others are from Malaysia and Asia.<br/><br/>what I enjoy most is the section on Peranakan cuisine, embroidery, handiwork and their wedding practices.  <br/><br/>The Peranakan Museum is not a place to miss, if you like to find out more about Singapore's multicultural society, our culture and our traditions.<br/><br/>Also, there is a shop selling souvenirs and a little café selling only Perankan food, snacks and lovely meals served in Peranakan style!<br/><br/>Come and see and experience this special part of Singapore!"
Phillyjanie,221,Aug 2013,July 2013,50,So interesting,This museum really explains local society. I found it fascinating and it's literally around the corner from the National Museum.
antHongKong,25,Aug 2013,July 2013,40,Well worth a visit,The museum provides a great insight into the culture of the Peranakans but is not overwhelming. The display is very colourful and interesting.
Leny Y,76,Aug 2013,June 2013,40,Not much as I expected...,"Quite okay... it's a building with ""stack of floors"", pretty much you can see, but there's no lift... Stairs are everywhere, quite tiring. Not recommended if you bring young children.<br/>Else, you can see the culture of Peranakan 3 nations: Malay, Chinese, and Singapore.. and about how they grow... all the habits when Peranakan society got married, birth, dead.. etc.<br/>They put it visually, so overall for me, this place is okay :)"
Sidmar H,29,Aug 2013,July 2013,50,Peranakan is small but good!,"This museum has everything I like:  lots of jewelry, wedding clothes, wedding traditions, and textiles, especially beadworking with super tiny beads.  The Peranakan peoples are the early settlers of Singapore and this museum displays their ways of life from food, wedding customs, babies, furniture, and ceramics.  Really nice place."
David S,40,Jul 2013,November 2012,30,Expected more,Seems like just bits and pieces are displayed. The exhibits seemed oddly coordinated centering on a few daily activities.
Tolis P,8,Jul 2013,March 2013,50,Every time I want to know more about Singapore...,"... I go to the Peranakan Museum. Every time a friend is passing through or visits, I either send them or go with them. It is a small but nicely laid out Museum with lots of detailed information of Singapore's mixed cultural and ethnic background. Easy to take in the information laid out and all the personnel I friendly and accommodating."
Simon E,48,Jul 2013,May 2013,50,Fantastic insight,"Not usually high on most tourists 'must see' list but take time out to visit. If you don't know who the Peranakan's are/were and how they influence Singapore life, you really really have to visit the museum. Not a bad Peranakan restaurant next door...if a little grumpy staff. This won't be boring for the kids either. It shows, history, customs, dress, food exceptionally well done. Get a guide - cheap and worth it."
iTravel_Dave,48,Jul 2013,May 2013,20,Just another Museum,"This Museum is too small. you can finish it in one hour time. Unless you are very keen in history between malay &amp; chinese marriage. If not, you will find it boring."
Uta L,40,Jul 2013,February 2013,40,Interesting,Went with my daughter's class and really enjoyed the visit. Manages to stay behind when they went back to school to get a quiet look at the exhibition. Gives a good insight into one part of Singaporean society. Done very well for kids and adults alike.
bene66,13,Jul 2013,August 2012,50,beautiful little museum,"We have been at least 5 time there with the kids. Not too big, very colourful. Various rooms to enjoy. For everyone."
Declan C,5,Jul 2013,July 2013,50,Very informed,Lovely and very quaint museum - great value to get in and guide very helpful ! A lovely location and a worthwhile visit !
GVasc,8,Jul 2013,July 2013,50,A jewel in Singapore,"This museum is so unique. You get a sense of who were the native population, how they lived, living habits, so you can better understand and admire Singapore"
Julie S,59,Jul 2013,July 2013,40,pleasant visit,A small museum but a very pleasant visit and my kids got to understand a bit of the Peranakan culture!<br/>Free admission for Singaporeans and Singapore PR holders.<br/>All other visitors have to pay.<br/>Adult: $6<br/>Child:  $3
duntiblaesnob,210,Jul 2013,July 2013,40,A lovely museum with excellent displays,This is the place to visit if you are interested in learning about the story behind the mix of races in singapore. The displays are beautiful and the explanations informative. The children loved the interacive displays and the search for the stamps for their visitor cards.
SnowmanSnipe,147,Jul 2013,July 2013,50,Cultural and enlightening,"This is a beautiful museum - small in size but contains fascinating exhibits. My grandmother is Peranakan but so much of our roots and traditions are diluted. Visiting this museum struck a chord in my heart. The exhibits are well organized- from origins of peranakan people to the marriage rites, to clothes, items used, dining traditions, funeral rites etc. It's a great place to while away a hot Saturday afternoon. There is no Admission fee for locals but an admission fee of sgd6 is imposed on tourists. There is a quaint cafe outside and of course a gift shop for souvenirs!"
Baarie,9,Jul 2013,June 2013,30,ok-ish,I did not see exabitons that you had to pay for. This is free if you are a Singapore resident otherwise its $15 But dose give you some information on Singapore people who have exturanry lives
olderfolks,138,Jul 2013,July 2013,30,Average,This is a smallish museum which traces the history and culture of the Peranakan peoples of south-east Asia.<br/>What there is of it is quite well done and those with an interest in textiles and furniture will find it repays a visit.
David H,89,Jul 2013,June 2013,40,Lots of exhibits of wedding traditions,"This museum is housed in a very attractive historic building. Its exhibits cover the people who came from other parts of Asia and married and settled in Singapore – Peranakans. It gives interesting insights into how they came to Singapore and how they lived. There are free guided tours.<br/><br/>The exhibit is especially strong in the area of Peranakan wedding traditions. If you aren't very interested in weddings, your visit will not be as long."
age_m82,27,Jun 2013,April 2013,30,Learn about the Peranakan history,"Like: the lovely building architecture!! all the intricate design of Peranakan wedding tradition, interesting 'telephone' conversation, bring blank color paper/white paper to stamp for free. <br/><br/>Dislike: Tourists will be charged $6, but locals can go for free. However, museum securities/front desk people not as friendly with tourists. Ask one of them to take picture for all of us and they refused. We were a bit dumbfounded by their unfriendliness"
wea74,19,Jun 2013,June 2013,40,interesting,I found it hard to get a handle on this culture and the signage didn't help that much.  I found it more a curiosity than anything else.  I wouldn't bother if I had limited time.
sand2skis,331,Jun 2013,July 2012,50,"A ""Must Do"" for tourists &amp; locals alike","I have been visiting Singapore regularly over the last 30+ years, and with every visit, I find the Singapore of Old further eroded by more development and modernisation. Singapore has lost much (some would argue, almost all) of its original character and charm. <br/><br/>Much of it is visually obvious in the absence of old Colonial and Peranakan buildings, having been demolished to make way for new commercial buildings. What is not so apparent is the erosion of one of the region's significant people and distinctive cultures - the Peranakans (or Nyonya-Baba). A people who were historically integral to the fabric of Singapore and Malaya.  <br/><br/>I could expand on the Peranakans but I will refrain from doing so as it will take much too long. However suffice to say that Singapore and Malaysia's rich history and development over centuries would indubitably be vastly different and lesser (in my humble opinion), if not for the Peranakans. For those interested, all you need do is Google the term 'Peranakan' on the internet. <br/><br/>Given that Peranakan culture and its tangible being (in the form of eg buildings, dress, furniture, artwork and so on) are fast disappearing through modernisation and influx of literally thousands of expats and foreign-born people, the Peranakan Museum is an indispensable heritage institution.<br/><br/>My visit to the museum was in 2010 and was the highlight of my vacation. For me personally, it brought back many wonderful memories of growing up in Singapore and Malaysia. <br/><br/>I have no doubt that the Peranakan Museum will be a wonderful experience for all visitors - whether a local, an expat who has spent years working in Singapore or the casual tourist to the country.<br/><br/>The museum is well organised and presented, with a comprehensive collection of displays. Descriptions of exhibits were concise, yet adequately comprehensive, to provide the reader with a good level of information without being boring or tedious. The museum is on my list of 'things to do' on my next visit to Singapore.    <br/><br/>Entry cost is reasonable and I would recommend allocating between 3 to 4 hours to do justice to the museum and its exhibits. If pushed for time, allow 1.5 to 2 hours for a quick overview. A guided tour is highly recommended.<br/><br/>The museum is located in town, adjacent to the historical Fort Canning and a short walk from famous Orchard Road. <br/><br/>Lastly, for those visiting Malaysia, there is also a Peranakan Museum in Penang. I have not been there before but it is definitely on my list."
CowSense,979,Jun 2013,June 2013,50,"The Peranakan Museum at 39 Armenian Street, Singapore","The Peranakan Museum is a collection of Nonya history and artifacts in the old Tao Nan School. You can see  Nonya costumes and dress, wedding jewelry and  gift from  groom to the bride. The Paranakan profess Buddhist, Toaist and  Christianity.  They eat pork  though they dress like the Malays. There are lifts for the elderly who cannot climb the steps on the staircase."
Russell1979,150,Jun 2013,December 2012,40,A good education on the Peranakan way of life,"Gives you an insight on the Peranakan history and culture. There are different galleries, where you can learn about their traditional wedding, gift sharing, food, religion, art etc."
Isabel089,114,Jun 2013,May 2013,50,a window into a fascinating culture,This lovely museum gives good background to the special mix of cultures that developed in Singapore and other cities along the Straits of Malacca. The displays are beautiful and informative.
